author,created_utc,domain,url,title,subreddit
u37644,1650705245,bangaloremirror.indiatimes.com,https://bangaloremirror.indiatimes.com/bangalore/civic/bengaluru-taps-run-dry/articleshow/90670904.cms,Bengaluru taps run dry,worldnews
[deleted],1650705202,news18.com,https://www.news18.com/news/opinion/infra-vaani-infra-woes-for-indian-silicon-valley-bengaluru-5006509.html,"Infra Vaani | Infra Woes are Chipping Away at India’s Silicon Valley, Bengaluru is Battling for Survival",worldnews
[deleted],1650705185,news18.com,https://www.news18.com/news/opinion/infra-vaani-infra-woes-for-indian-silicon-valley-bengaluru-5006509.html,"Infra Woes are Chipping Away at India’s Silicon Valley, Bengaluru is Battling for Survival",worldnews
Ifukbull,1650705068,cbc.ca,https://www.cbc.ca/news/health/omicron-immunity-canada-covd19-vaccines-1.6428536,Almost half of Canadians may have caught COVID,worldnews
saltreplacement2,1650705048,theguardian.com,https://www.theguardian.com/world/2022/apr/23/eu-agrees-rules-to-force-big-tech-to-rein-in-content-or-face-huge-fines,EU agrees rules to force big tech to rein in illegal content or face huge fines,worldnews
pokeoem,1650705013,dailymail.co.uk,https://www.dailymail.co.uk/news/article-10745839/Ukraine-war-country-world-want-nuclear-weapons-WH-adviser-claims.html,"Every country in the world will now want nuclear weapons because Putin has shown if you have a nuke, nobody will aid your enemies, former White House adviser claims",worldnews
qowmeor,1650704839,markets.businessinsider.com,https://markets.businessinsider.com/news/stocks/russia-financial-markets-chaotic-ruble-stocks-bonds-vultures-capital-controls-2022-4?utm_source=feedly&amp;utm_medium=webfeeds,"A Moscow broker explains what's happening in Russia's chaotic markets, where vultures are scavenging for profit and the Kremlin is propping up stocks and the ruble",worldnews
LittlePrince123,1650704088,moe.gov.cn,http://www.moe.gov.cn/srcsite/A26/s8001/202204/t20220420_619921.html,"China cancel English teaching. History&amp;Geography, P.E., Art&amp;Music, Physics&amp;Chemistry, become more important subjects.",worldnews
foxwolflion,1650703958,indiatoday.in,https://www.indiatoday.in/world/russia-ukraine-war/story/special-operation-ukraine-nato-threat-russia-war-diplomat-1939945-2022-04-21,"Will end special operation in Ukraine when Nato threat is removed, says Russia",worldnews
sobandi23,1650703917,footballnews.eu.org,https://www.footballnews.eu.org/2022/04/data-and-facts-arsenal-vs-manchester-united.html,Data and Facts: Arsenal vs Manchester United,worldnews
LittlePrince123,1650703897,baijiahao.baidu.com,https://baijiahao.baidu.com/s?id=1730878722882858896&amp;wfr=spider&amp;for=pc,"China cancel English teaching. History&amp;Geography, P.E., Art&amp;Music, Physics&amp;Chemistry, become more important subjects.",worldnews
molokoplus359,1650703878,news.yahoo.com,https://news.yahoo.com/russia-ukraine-latest-news-russia-234445648.html,"More than 20,000 troops killed or missing, Russian officials appear to admit",worldnews
madrid987,1650703798,newsweek.com,https://www.newsweek.com/russian-soldiers-raising-soviet-flag-over-occupied-ukraine-cities-1699865,Russian soldiers raising Soviet flag over occupied Ukraine cities,worldnews
foxwolflion,1650703779,apnews.com,https://apnews.com/article/russia-ukraine-putin-business-europe-world-news-c1062700198448759e428e51ff0d289f,Ukraine: Russians shift elite units to the new battleground,worldnews
fawryiran,1650703110,reuters.com,https://www.reuters.com/world/china/shanghai-reports-12-new-covid-deaths-frustrations-boil-over-2022-04-23/,Anger mounts among locked-down Shanghai residents as city reports more COVID deaths,worldnews
itSmellsLikeSnotHere,1650702789,theconversation.com,https://theconversation.com/russia-faces-first-foreign-default-since-1918-heres-how-it-could-complicate-putins-ability-to-wage-war-in-ukraine-181139,Russia faces first foreign default since 1918 – here's how it could complicate Putin's ability to wage war in Ukraine,worldnews
molokoplus359,1650702673,rferl.org,https://www.rferl.org/a/russia-offensive-stalls-donbas-odesa/31817382.html,Russia's Offensive Said Stalled In Ukraine Amid Warnings Of Putin's Wider Aims,worldnews
NinjaElectricMeteor,1650702513,nltimes.nl,https://nltimes.nl/2022/04/23/russian-amsterdam-trade-bank-declared-bankrupt-due-sanctions,Russian Amsterdam Trade Bank declared bankrupt due to sanctions | NL Times,worldnews
AdditionStriking6755,1650702402,grooming.mobi,https://grooming.mobi/dog-grooming/taunton-dog-grooming-salon-owner-to-join-crufts-with-her-pets/,Taunton dog grooming salon owner to join Crufts with her pets,worldnews
WoolfordStudiosLtd,1650702198,youtube.com,https://www.youtube.com/watch?v=91Y3jjVGPq4&amp;feature=youtu.be,Sweets Skyscraper Daily 23-04-2022,worldnews
foxwolflion,1650702156,timesofindia.indiatimes.com,https://timesofindia.indiatimes.com/india/naqvi-lashes-out-at-uk-mp-for-india-phobia/articleshow/91017192.cms,"Naqvi lashes out at UK MP for ""India phobia""",worldnews
no_one_6,1650702114,hindustantimes.com,https://www.hindustantimes.com/entertainment/hollywood/will-smith-makes-first-public-appearance-after-oscars-slap-in-india-gets-spotted-at-mumbai-airport-check-out-pics-101650695627665-amp.html,"Will Smith makes first public appearance after Oscars slap row in India, gets spotted at Mumbai airport.",worldnews
foxwolflion,1650702078,ndtv.com,https://www.ndtv.com/india-news/been-very-clear-with-india-dont-want-to-see-them-rely-on-russia-pentagon-2912473,"""Been Very Clear With India, Don't Want To See Them Rely On Russia"": Pentagon",worldnews
Altruistic_Cut6105,1650701982,reuters.com,https://www.reuters.com/technology/eu-countries-lawmakers-clinch-deal-new-online-content-rules-2022-04-23/,"EU sets new online rules for Google, Meta to curb illegal content | Reuters",worldnews
foxwolflion,1650701941,ndtv.com,https://www.ndtv.com/india-news/in-joe-bidens-point-about-autocrats-dictatorships-a-comment-on-india-2912788,"""India Has Its Own Problems"": Joe Biden's Side Note On Dictatorships",worldnews
telcoman,1650701898,youtu.be,https://youtu.be/aEpk_yGjn0E,The price of war - can Russia afford a long conflict?,worldnews
Altruistic_Cut6105,1650701742,express.co.uk,https://www.express.co.uk/news/world/1599946/Ukraine-Live-Vladimir-Putin-war-Russian-forces-invasion-Mariupol-Donbas-updates,Desperate Putin 'sends inoperable kit back over border' as new mission fails | World | News | Express.co.uk,worldnews
9x99x,1650701654,reuters.com,https://www.reuters.com/world/europe/russia-says-it-shot-down-ukrainian-fighter-jet-kharkiv-region-2022-04-23/,Russia says it shot down Ukrainian fighter jet in Kharkiv region,worldnews
HeeWhoRemains,1650701653,m.timesofindia.com,https://m.timesofindia.com/city/madurai/12-year-old-tn-boy-held-for-rape-after-girl-17-delivers-baby/articleshow/90989804.cms,"12-year-old Indian boy arrested for allegedly raping a 17-year-old girl, who has delivered a baby",worldnews
HeeWhoRemains,1650701460,m.timesofindia.com,https://m.timesofindia.com/india/12-year-old-tn-boy-held-for-rape-after-girl-17-delivers-baby/amp_articleshow/90989804.cms,12-year-old Indian boy arrested for alleged rape of a 17-yr-old after her delivery,worldnews
foxwolflion,1650701325,timesofindia.indiatimes.com,https://timesofindia.indiatimes.com/world/rest-of-world/taiwan-details-new-advanced-missile-and-drone-attack-capabilities/articleshow/90993528.cms,Taiwan details new advanced missile and drone attack capabilities - Times of India,worldnews
AdditionStriking6755,1650701227,grooming.mobi,https://grooming.mobi/pet-business/affordable-nutrition-from-harringtons-pet-trade-news-events-from-pet-business-world-uk/,"Affordable nutrition from harringtons , Pet Trade News",worldnews
LengthExact,1650701142,metro.co.uk,https://metro.co.uk/2022/04/23/ukraine-france-and-germany-sents-arms-to-russia-despite-eu-blockade-16521171/,Ukraine: France and Germany 'sents arms to Russia' despite EU blockade,worldnews
LengthExact,1650701046,thetimes.co.uk,https://www.thetimes.co.uk/article/ten-eu-countries-sold-kit-to-russia-despite-sanctions-dtt3jxgfs,Ten EU countries sold weapons to Russia despite sanctions,worldnews
DoppelgangerHornet,1650700998,washingtonpost.com,https://www.washingtonpost.com/world/2022/04/22/trump-says-he-threatened-not-defend-nato-russia/,Trump says he threatened not to defend NATO against Russia,worldnews
foxwolflion,1650700871,indiatoday.in,https://www.indiatoday.in/india/story/russia-ukraine-conflict-india-manmohan-singh-1940677-2022-04-22,Opportunity for India to expand trade amid Russia-Ukraine crisis: Manmohan Singh,worldnews
Erkiin,1650700809,twitter.com,https://twitter.com/IsraelMFA/status/1517395243523579904,Muslim worshipers remove violent Palestinian rioters from the courtyards of Al-Aqsa so that they can pray safely,worldnews
TanzaniaTech,1650700803,tanzaniatech.one,https://www.tanzaniatech.one/2022/04/halotel-ina-kasi-bora-zaidi-ya-mtandao/,Utafiti : Halotel Ina Kasi Bora Zaidi ya Mtandao Tanzania,worldnews
foxwolflion,1650700765,cnn.com,https://www.cnn.com/2022/04/21/politics/official-coordinating-military-assistance-to-ukraine/index.html,White House brings on retired three-star general to help coordinate Ukraine assistance,worldnews
hjgbuijhgh,1650700374,movieweb.com,https://movieweb.com/johnny-depp-never-return-pirates-of-the-caribbean/,JohnnyDepp Says He Will Never Return to the Pirates of the Caribbean Franchise,worldnews
hjgbuijhgh,1650700317,movieweb.com,https://movieweb.com/johnny-depp-never-return-pirates-of-the-caribbean/,Johnny Depp Says He Will Never Return to the Pirates of the Caribbean Franchise,worldnews
AdditionStriking6755,1650700316,grooming.mobi,https://grooming.mobi/pet-grooming/get-your-furry-friends-groomed-on-the-go/,Get your furry friends groomed on the go,worldnews
laksaleaf,1650700211,bbc.com,https://www.bbc.com/news/world-asia-china-61160210,Shanghai lockdown: Whole communities relocated in anti-Covid drive,worldnews
CarlKenlik,1650700004,insightcrime.org,https://insightcrime.org/news/coca-growing-cocaine-production-reach-new-heights-in-honduras/,"Coca Growing, Cocaine Production Reach New Heights in Honduras",worldnews
Bloke22,1650699765,dailymail.co.uk,https://www.dailymail.co.uk/news/article-10745351/Portugal-EU-country-fast-track-entry-Britons.html,Portugal has become the first EU country since Brexit to allow UK visitors to be fast-tracked through electronic passport gates,worldnews
Content_Profile2677,1650699537,thedailybeast.com,https://www.thedailybeast.com/russian-general-lets-slip-a-secret-plan-to-invade-moldova-and-seize-ukraines-entire-coastline,Russian General Lets Slip Secret Plan to Invade New Country,worldnews
qowmeor,1650699280,msn.com,https://www.msn.com/en-us/news/world/french-election-macron-in-pole-position-le-pen-racing-hard/ar-AAWvso7?ocid=EMMX&amp;cvid=98a38405608445ca937322d20d121585,"French election: Macron in pole position, Le Pen racing hard",worldnews
lorenzomofo,1650699005,theguardian.com,https://www.theguardian.com/world/2022/apr/22/sound-of-april-chinese-netizens-get-creative-to-keep-censored-film-in-circulation,'Voice of April': Chinese netizens get creative to keep censored film on social media,worldnews
Ukraina_Novosti,1650698597,tsn.ua,https://tsn.ua/en/ato/cynically-do-not-release-civilians-vereshchuk-explained-to-the-world-how-russia-refuses-to-open-a-humanitarian-corridor-from-azovstal-2043745.html,"""Cynically do not release civilians"": Vereshchuk explained to the world how Russia refuses to open a humanitarian corridor from ""Azovstal""",worldnews
WoolfordStudiosLtd,1650698597,youtube.com,https://www.youtube.com/watch?v=UQ-bRwy8Q9E&amp;feature=youtu.be,Deep Dive Daily 23-04-2022,worldnews
AdditionStriking6755,1650697968,grooming.mobi,https://grooming.mobi/pet-grooming/angry-shih-tzu-goes-from-aggressive-to-adorable-during-haircut/,Angry Shih Tzu goes from aggressive to adorable during haircut,worldnews
CapeTHC,1650697934,economist.com,https://www.economist.com/china/2022/04/21/china-says-imports-are-causing-outbreaks-of-covid-19,China says imports are causing outbreaks of covid-19,worldnews
pleasantzones,1650697891,aljazeera.com,http://www.aljazeera.com/news/2022/4/23/pakistan-top-body-says-no-us-plot-in-ex-pm-imran-khans-removal,Pakistan top body says no US plot in ex-PM Imran Khan’s removal,worldnews
pleasantzones,1650697838,aljazeera.com,https://www.aljazeera.com/news/2022/4/23/pakistan-top-body-says-no-us-plot-in-ex-pm-imran-khans-removal,Pakistan top body says no US plot in ex-PM Imran Khan’s removal,worldnews
Front_Man-44,1650697683,m.economictimes.com,https://m.economictimes.com/news/economy/foreign-trade/india-facing-difficulties-with-wto-on-exporting-cereals-amidst-global-food-crisis-fm-nirmala-sitharaman/articleshow/91019610.cms,India facing difficulties with WTO on exporting cereals amidst global food crisis: Indian Finance Minister,worldnews
AbdurRehman771,1650697595,youtu.be,https://youtu.be/Zo7kP0tMSs4,Urdu Naat,worldnews
market_wave,1650697554,bbc.com,https://www.bbc.com/news/world-europe-61188943,"Russia aiming for full control of the south, commander says",worldnews
MissiveCunt,1650697491,thinkpol.ca,https://thinkpol.ca/2022/04/22/eu-reaches-landmark-deal-on-hate-speech-disinformation/,"EU reaches landmark deal on hate speech, disinformation",worldnews
CreepzFPS,1650697111,msn.com,https://www.msn.com/en-gb/news/world/russia-ukraine-war-latest-zelenskiy-warns-moscow-wants-to-capture-other-countries-as-russia-pushes-to-seize-southern-ukraine-live/ar-AAWtiYO?ocid=msedgntp&amp;cvid=3edfa08ca0e141f6b950189609c6a2d5,Zelenskiy warns Moscow wants to ‘capture other countries’ as Russia pushes to seize southern Ukraine,worldnews
suttonnick,1650696989,news.sky.com,https://news.sky.com/story/ukraine-war-how-the-azovstal-steelworks-turned-into-the-final-outpost-in-the-brutal-battle-for-mariupol-12596069,Ukraine war: How the Azovstal steelworks turned into the final outpost in the brutal battle for Mariupol | World News,worldnews
7788-7788,1650696344,youtube.com,https://youtube.com/watch?v=y46-dNz3UOE&amp;feature=share,"Live Chart Of Volkswagen Squeeze Oct 26/2008 This Is It AMC, GME Will ...",worldnews
Nicolelaurelln,1650696173,go2affm.com,https://go2affm.com/c/?p=18316&amp;o=8031&amp;s1=qw,Sign up and start making cash from home!,worldnews
eldashev,1650695436,reuters.com,https://www.reuters.com/world/europe/uk-says-russian-forces-made-no-major-gains-last-24-hours-2022-04-23/,UK says Russian forces made no major gains in the last 24 hours,worldnews
AdditionStriking6755,1650695209,grooming.mobi,https://grooming.mobi/dog-grooming/the-former-banker-helping-with-the-cost-of-pet-grooming/,The former banker helping with the cost of pet grooming,worldnews
Aanandertoe,1650695129,washingtonpost.com,https://www.washingtonpost.com/video-games/2022/04/22/netflix-video-games/,"Amid losses, Netflix bets on a bold strategy around video games",worldnews
Nicolelaurelln,1650695094,go2affm.com,https://go2affm.com/c/?p=18316&amp;o=8031&amp;s1=qw,Sign up and start making cash from home!,worldnews
failed_evolution,1650694727,euobserver.com,https://euobserver.com/tickers/154779,"Gas payments in roubles may be possible, EU commission says",worldnews
Aanandertoe,1650694544,lemonde.fr,https://www.lemonde.fr/en/politics/article/2022/04/18/a-minority-of-melenchon-supporters-plan-to-vote-for-macron-in-second-round_5980907_5.html,A minority of Mélenchon supporters plan to vote for Macron in the presidential election second round,worldnews
pokeoem,1650693992,theguardian.com,https://www.theguardian.com/world/2022/apr/23/us-warns-solomon-islands-against-china-military-base-as-australian-mps-trade-blame,US warns Solomon Islands against China military base as Australian MPs trade blame,worldnews
RazzmatazzLost2431,1650693510,go2affm.com,https://go2affm.com/c/?p=18372&amp;o=9185&amp;s1=monir,"👉 Discover a amazing career at Coca-Cola. 🔥 Their jobs come with competitive pay, benefits, opportunities for career advancement, and more. Apply now for Coca-Cola Jobs. 🔥 👉 See all details here. Discover a amazing career at Coca-Cola. Join Today! 🔥",worldnews
qowmeor,1650693158,abcnews.go.com,https://abcnews.go.com/International/wireStory/russia-shifts-forces-battle-ukrainian-heartland-84258082,Russia shifts forces for battle over Ukrainian heartland,worldnews
pokeoem,1650693067,theguardian.com,https://www.theguardian.com/world/2022/apr/23/zelenskiy-warns-ukraine-invasion-only-the-beginning-as-russia-signals-southern-push,Zelenskiy warns Ukraine invasion only the beginning as Russia signals southern push,worldnews
Andersoilkinson,1650692680,eliteyelp.com,https://eliteyelp.com/product/buy-verified-paypal-accounts/,Buy Verified PayPal Accounts - Fully US Documents Verified,worldnews
focus_mg,1650692647,youtu.be,https://youtu.be/xMEl3QzaLhk,russia spy satellite,worldnews
dcrm,1650692524,bbc.co.uk,https://www.bbc.co.uk/news/business-61193141,Supermarkets set limits on sale of cooking oil,worldnews
KaiCub-mySzon,1650692468,politico.eu,https://www.politico.eu/article/trolling-russia-ukraine-registers-moskva-shipwreck-underwater-cultural-heritage/,"Trolling Russia, Ukraine registers Moskva shipwreck as ‘underwater cultural heritage’ – POLITICO",worldnews
Empty_Worldliness_84,1650692461,carplay.youcan.shop,https://carplay.youcan.shop/,Bmw Apple CarPlay Lifetime Activation + Fullscreen + Video in motion,worldnews
Lost-Original-3176,1650692385,youtu.be,https://youtu.be/rXNTxOkOWDk,Top 20 Games,worldnews
hjgbuijhgh,1650691926,fiercetelecom.com,https://www.fiercetelecom.com/telecom/att-chief-says-hes-not-happy-about-how-fast-wages-are-rising,AT&amp;T chief says he’s not happy about how fast wages are rising. Gives himself 18% pay rise.,worldnews
hjgbuijhgh,1650691823,fiercetelecom.com,https://www.fiercetelecom.com/telecom/att-chief-says-hes-not-happy-about-how-fast-wages-are-rising,AT&amp;T chief says he’s not happy about how fast wages are rising,worldnews
eosphoros666,1650691660,middleeastmonitor.com,https://www.middleeastmonitor.com/20220420-respect-religious-beliefs-of-muslims-china-tells-sweden/,"Respect religious beliefs of Muslims, China tells Sweden",worldnews
bogusssssss,1650691008,bellinghamherald.com,https://www.bellinghamherald.com/news/business/national-business/article260648127.html,EXPLAINER: Why Washington is boosting heavy arms for Ukraine,worldnews
hjgbuijhgh,1650690808,unilad.co.uk,https://www.unilad.co.uk/politics/ted-cruz-says-disney-is-going-to-make-mickey-mouse-have-sex-with-pluto-20220421.amp.html,Ted-Cruz Says Disney Is Going To Make Mickey Mouse Have Sex With His Dog Pluto,worldnews
dockneel,1650690794,bbc.co.uk,https://www.bbc.co.uk/news/world-europe-61191111,BBC News - Ukraine war: Inside Kyiv's trench defences,worldnews
Russell_3,1650690760,reuters.com,https://www.reuters.com/world/europe/macron-le-pens-campaign-draws-anger-i-have-not-managed-quell-2022-04-22/,Macron tells voters: Now choose the France you want,worldnews
SIEGE9,1650690695,usatoday.com,https://www.usatoday.com/story/tech/2022/04/22/european-union-law-meta-facebook-google/7419892001/,EU passes historic law to hold social media sites accountable for illegal content 04.21.22,worldnews
Russell_3,1650690660,reuters.com,https://www.reuters.com/world/china/china-must-raise-air-quality-standards-smog-persists-task-force-2022-04-23/?taid=626388fd7d8a3200016e7b7f&amp;utm_campaign=trueAnthem:+Trending+Content&amp;utm_medium=trueAnthem&amp;utm_source=twitter,China must raise air quality standards as smog persists -task force,worldnews
sakurawaiver,1650690513,newsweek.com,https://www.newsweek.com/taliban-announces-countrywide-tiktok-ban-due-immoral-effects-youth-1700209,"Afghanistan ban TikTok due to ""immoral"" effects on youth, Taliban spokesman tweeted.",worldnews
hjgbuijhgh,1650690194,metro.co.uk,https://metro.co.uk/2022/03/28/man-stabbed-girlfriend-in-bum-because-they-couldnt-agree-where-to-buy-pizza-16356228/?ito=article.mweb.share.top.link,Man stabbed girlfriend in bum because they couldn't agree where to buy pizza,worldnews
AdditionStriking6755,1650690153,grooming.mobi,https://grooming.mobi/pet-grooming/zuri-pet-spa-expands-with-rancho-mission-viejo-location/,Zuri Pet Spa Expands with Rancho Mission Viejo Location,worldnews
Vaginal-_-Cream,1650690077,cnbc.com,https://www.cnbc.com/2022/04/21/watch-live-biden-announces-massive-new-aid-package-for-ukraine-.html,Watch live: Biden announces massive new aid package for Ukraine,worldnews
ynoor671,1650690077,youtube.com,https://youtube.com/shorts/1dLW_jG0NjE?feature=share,Islamic,worldnews
Original_Tonight9395,1650689997,youtube.com,https://youtube.com/shorts/0SK6KypPOx4?feature=share,Before you continue to YouTube,worldnews
Original_Tonight9395,1650689933,youtube.com,https://youtube.com/shorts/0SK6KypPOx4?,Failed Kidnapping as Woman Escapes,worldnews
hjgbuijhgh,1650689597,news.sky.com,https://news.sky.com/story/driverless-car-starts-to-pull-away-after-being-stopped-by-police-12588083,Driverless car starts to pull away after being stopped by police,worldnews
ThorDansLaCroix,1650689347,ft.com,https://www.ft.com/content/ee25056f-1918-4c24-9f64-ce4e9131780b,No taxes. No welfare. Welcome to libertarian paradise island,worldnews
Vaginal-_-Cream,1650689176,cnbc.com,https://www.cnbc.com/2022/04/22/carlos-ghosn-says-he-expects-fair-trial-in-france-following-arrest-warrant.html,"Carlos Ghosn says he would face fair trial in France, suggests timing of arrest warrant ‘suspicious’",worldnews
AdditionStriking6755,1650689015,grooming.mobi,https://grooming.mobi/pet-business/natural-instinct-sponsors-gb-dog-agility-team-pet-trade-news-events-from-pet-business-world-uk/,"Natural instinct sponsors gb dog agility team , Pet Trade News",worldnews
spinx248,1650688400,yahoo.com,https://www.yahoo.com/news/chinese-mine-manager-rwanda-sentenced-235647279.html,Chinese mine manager in Rwanda sentenced to 20 years in prison for whipping local workers,worldnews
qowmeor,1650688239,msn.com,https://www.msn.com/en-us/news/world/russias-standing-in-g-20-not-threatened-by-ukraine-invasion/ar-AAWvoM8,Russia's standing in G-20 not threatened by Ukraine invasion,worldnews
foxwolflion,1650688110,thehindu.com,https://www.thehindu.com/news/international/israeli-police-storm-jerusalem-holy-site-after-rock-throwing/article65344383.ece,Israeli police storm Jerusalem holy site after rock-throwing,worldnews
Hugobrookz,1650688085,camera24.in,https://camera24.in/world/google-doodles-celebrate-iraqs-contemporary-painter-naziha-salim/,Google doodles celebrate Iraq’s contemporary painter Naziha Salim,worldnews
prixb,1650688079,reuters.com,https://www.reuters.com/world/and-who-will-come-next-warns-zelenskiy-after-russian-general-eyes-southern-2022-04-22/,Zelenskiy warns Russia is eyeing other countries after Ukraine,worldnews
foxwolflion,1650688079,thehindu.com,https://www.thehindu.com/news/international/moscow-eyes-all-of-ukraines-east-south/article65345391.ece,"Moscow eyes all of Ukraine’s east, south",worldnews
ThisIsExxciting,1650688064,cnn.com,https://www.cnn.com/2022/04/22/world/madeleine-mccann-case-portuguese-formal-suspect-intl-scli/index.html,Portuguese prosecutors say man named formal suspect in McCann case,worldnews
foxwolflion,1650688043,thehindu.com,https://www.thehindu.com/sport/other-sports/russian-swimmer-rylov-banned-for-appearing-at-putin-rally/article65346518.ece,Russian swimmer Rylov banned for appearing at Putin rally,worldnews
bangthetank,1650687948,thehindu.com,https://www.thehindu.com/news/international/india-extends-duration-of-400-million-currency-swap-facility-with-sri-lanka/article65344950.ece,India extends duration of $400 million currency swap facility with Sri Lanka,worldnews
BousWakebo,1650687505,news.sky.com,https://news.sky.com/story/ukraine-war-countrys-top-prosecutor-accuses-russia-of-pre-planning-mass-murder-torture-and-rape-12596074,"Ukraine war: Country's top prosecutor accuses Russia of pre-planning mass murder, torture and rape",worldnews
Similar_Cheesecake_9,1650687151,tribuneindia.com,https://www.tribuneindia.com/news/nation/us-discourages-indias-reliance-on-russia-for-defence-needs-pentagon-388782,US discourages India’s reliance on Russia for defence needs: Pentagon,worldnews
pinksunshiness,1650687074,reuters.com,https://www.reuters.com/world/and-who-will-come-next-warns-zelenskiy-after-russian-general-eyes-southern-2022-04-22/,Zelenskiy warns Russia is eyeing other countries after Ukraine,worldnews
Similar_Cheesecake_9,1650686824,aljazeera.com,https://www.aljazeera.com/news/2022/4/23/un-chief-to-meet-putin-zelenskyy-in-push-for-peace,Antonio Guterres will travel first to Moscow and then to Kyiv to discuss ‘steps that can be taken right now’ to stop fighting.,worldnews
semshiv,1650686798,timesofindia.indiatimes.com,https://timesofindia.indiatimes.com/world/rest-of-world/google-doodles-celebrate-iraqs-contemporary-painter-naziha-salim-national-sovereignty-and-childrens-day-englands-old-tale-of-st-george/articleshow/91020002.cms,"Google doodles celebrate Iraq's contemporary painter Naziha Salim, National Sovereignty and Children's Day, England's old tale of St. George - Times of India",worldnews
that1_apple,1650686620,ukranews.com,https://ukranews.com/en/news/851905-moldova-completes-questionnaire-for-joining-eu,Moldova Completes Questionnaire For Joining EU,worldnews
WorldNewsMods,1650686579,reddit.com,https://www.reddit.com/live/18hnzysb1elcs,"/r/WorldNews Live Thread: Russian Invasion of Ukraine Day 59, Part 1 (Thread #198)",worldnews
AdditionStriking6755,1650686486,grooming.mobi,https://grooming.mobi/dog-grooming/woman-born-with-vocal-chord-paralysis/,Woman born with vocal chord paralysis,worldnews
foxwolflion,1650686039,tribuneindia.com,https://www.tribuneindia.com/news/nation/split-in-g20-on-boycott-of-russia-388585,Split in G20 on boycott of Russia,worldnews
