author,created_utc,domain,url,title,subreddit
agnes1223334444,1650844221,abc.net.au,https://www.abc.net.au/news/2022-04-25/jbs-meat-company-australia-four-corners-investigation/100997044,What you need to know about the global giant behind the food you eat,worldnews
Thalesian,1650843031,independent.co.uk,https://www.independent.co.uk/climate-change/news/climate-activist-dies-after-setting-himself-on-fire-outside-of-us-supreme-court-b2064299.html,Climate activist dies after setting himself on fire outside of US Supreme Court,worldnews
WordFit8789,1650842919,youtu.be,https://youtu.be/WV_7GaD7Nzk,Emmanuel Macron re-elected: the French president gives his victory speech,worldnews
dromni,1650842878,timesofisrael.com,https://www.timesofisrael.com/liveblog_entry/report-putin-loses-interest-in-ukraine-deal-wants-as-much-territory-as-possible/,"Report: Putin 'loses interest' in Ukraine deal, wants as much territory as possible",worldnews
worldbookreader,1650842798,republicworld.com,https://www.republicworld.com/world-news/russia-ukraine-crisis/putin-to-interact-with-russian-leaders-in-st-petersburg-on-april-27-amid-raging-war-articleshow.html,Putin to interact with Russian leaders in St. Petersburg on April 27 amid raging war,worldnews
Handicapreader,1650842754,reuters.com,https://www.reuters.com/world/europe/police-teargas-paris-protestors-after-macron-re-elected-2022-04-24/,Police teargas Paris protestors after Macron re-elected,worldnews
pikachu191,1650842753,nytimes.com,https://www.nytimes.com/live/2022/04/24/world/ukraine-russia-war-news?campaign_id=60&amp;emc=edit_na_20220424&amp;instance_id=0&amp;nl=breaking-news&amp;ref=headline&amp;regi_id=77513954&amp;segment_id=90157&amp;user_id=de5fc6e27226822f918cc3e90c8f7fe3,Ukraine Live Updates: Blinken and Austin Visit Kyiv to Meet With Zelensky,worldnews
Handicapreader,1650842682,reuters.com,https://www.reuters.com/world/africa/least-168-killed-western-darfur-violence-aid-group-2022-04-24/,"At least 168 killed in western Darfur violence, aid group says",worldnews
LansinGG,1650842635,news.sky.com,https://news.sky.com/story/police-open-fire-on-car-in-paris-killing-two-people-and-injuring-third-local-media-12598483,"Police open fire on car in Paris, killing two people and injuring third - local media | World News",worldnews
worldbookreader,1650842483,theguardian.com,https://www.theguardian.com/world/2022/apr/22/sound-of-april-chinese-netizens-get-creative-to-keep-censored-film-in-circulation,Shanghai: video maker urges people to stop sharing film critical of Covid lockdown,worldnews
perspicacious51,1650841993,youtu.be,https://youtu.be/UPThMHaJ594,The truth about western lies concerning mass Graves dump by RUSSIA,worldnews
kostiantyn76,1650841592,facebook.com,https://www.facebook.com/Kostiantyn.Tkachuk.Paper.2,Occupation of Ukraine?! The second paper. (The second paper. Initially published on 24 March 2022),worldnews
kostiantyn76,1650841518,independent.academia.edu,https://independent.academia.edu/KevinWhite53,War against Ukraine - Russian Failure or Scenario?! The Third Option. The First Paper. Initially published on 06 March 2022.,worldnews
spinx248,1650841516,thehill.com,https://thehill.com/policy/international/3461785-zelensky-meets-with-blinken-austin-in-kyiv-reports/,"Zelensky meets with Blinken, Austin in Kyiv: reports",worldnews
Ifukbull,1650841288,theguardian.com,https://www.theguardian.com/uk-news/2022/apr/23/at-least-one-child-has-died-from-mystery-strain-of-severe-hepatitis-who-confirms,"At least one child has died from mystery strain of severe hepatitis, WHO confirms",worldnews
jarrys88,1650841134,theguardian.com,https://www.theguardian.com/world/2022/apr/23/forget-the-presidency-i-can-lead-france-as-its-pm-insists-melenchon,"Forget the presidency, I can lead France as its PM, insists Mélenchon | France",worldnews
[deleted],1650840957,youtube.com,https://youtube.com/shorts/tdA5IG_MRg4,Meanwhile in paris,worldnews
titukaka,1650840842,teslanorth.com,https://teslanorth.com/2022/04/24/twitter-meeting-with-elon-musk-team-on-sunday-to-discuss-takeover-offer-report/,Twitter Meeting with Elon Musk Team on Sunday to Discuss Takeover Offer: Report - TeslaNorth.com,worldnews
ThisIsExxciting,1650840731,cnn.com,https://www.cnn.com/2022/04/24/china/beijing-covid-outbreak-lockdown-fears-intl-hnk/index.html,Beijing races to contain 'urgent and grim' Covid outbreak as Shanghai lockdown continues,worldnews
8zzzz,1650840612,thelondoneconomic.com,https://www.thelondoneconomic.com/news/watch-video-resurfaces-of-putin-singing-blueberry-hill-to-hollywood-celebs-315483/,"Putin sings ""Blueberry Hill"" and Kevin Costner loves it",worldnews
ThisIsExxciting,1650840573,cnbc.com,https://www.cnbc.com/2022/04/24/twitter-is-reportedly-taking-another-look-at-musk-takeover-bid.html,Twitter is reportedly taking another look at Musk takeover bid,worldnews
titukaka,1650840336,teslanorth.com,https://teslanorth.com/2022/04/24/twitter-meeting-with-elon-musk-team-on-sunday-to-discuss-takeover-offer-report/,Twitter Meeting with Elon Musk Team on Sunday to Discuss Takeover Offer: Report - TeslaNorth.com,worldnews
PuddingMango,1650840207,tomshardware.com,https://www.tomshardware.com/news/chinese-supercomputer-40-million-cores-exascale,40 Million Core Chinese Exascale Supercomputer Performs Quantum Simulations,worldnews
DoremusJessup,1650839200,dw.com,https://www.dw.com/en/slovenia-newcomer-set-to-oust-right-wing-premier-jansa/a-61572453,"Newcomer set to oust right-wing premier Jansa: Slovenian Prime Minister Janez Jansa looks to have lost his reelection bid to a green-liberal opposition party led by Robert Golob, according to partial results",worldnews
bogusssssss,1650839074,express.co.uk,https://www.express.co.uk/news/world/1600358/Vladimir-Putin-Kremlin-Easter-Orthodox-video-Russia-war-Ukraine-invasion-latest-news-vn,Vladimir Putin 'aware' of Russia's humiliation as Russian President caught 'grimacing' | World | News,worldnews
fishyfishfishyfishy,1650839029,jpost.com,https://www.jpost.com/breaking-news/article-705003,Rocket fired from Lebanon into Israel,worldnews
chandeliersdepot,1650838805,reuters.com,https://www.reuters.com/world/europe/russia-renews-mariupol-attacks-top-us-officials-visit-kyiv-ukraine-says-2022-04-24/,Ukraine to call for heavy arms when top U.S. officials visit Kyiv,worldnews
Ifukbull,1650838602,scitechdaily.com,https://scitechdaily.com/covid-19-third-dose-vaccine-protection-against-hospitalization-wanes-after-3-months/,COVID-19 Third Dose Vaccine Protection Against Hospitalization Wanes After 3 Months,worldnews
VinniGreti,1650838572,science-news.co,https://science-news.co/ufo-researchers-believe-this-video-of-a-flying-disc-next-to-a-passenger-plane-proves-the-existence-of-aliens/,UFO Researchers Believe This Video of a Flying Disc Next to a Passenger Plane Proves the Existence of Aliens,worldnews
ExactlySorta,1650838519,cbsnews.com,https://www.cbsnews.com/news/ukraine-war-mariupol-steel-plant-zelenskyy-blinken-austin/?ftag=CNM-00-10aab7e&amp;linkId=162263739,"Zelenskyy meets with U.S. secretaries of state and defense, Ukrainian official says",worldnews
KeyNeither416,1650838441,vt.tiktok.com,https://vt.tiktok.com/ZSdUDYqLd/,Information freedom fighters are the biggest threat to the NWO #censorship #realtalkmaddog #censored,worldnews
weeenerdog,1650838368,ctvnews.ca,https://www.ctvnews.ca/mobile/politics/russia-s-ambassador-to-canada-says-he-is-on-the-right-side-of-history-1.5873988,Russia's ambassador to Canada says he is 'on the right side of history',worldnews
cyndiafedericiz,1650838267,the4movie.com,https://the4movie.com,ดูหนังออนไลน์ ฟรี หนังใหม่ เร็วกว่าโรง THE4MOVIE,worldnews
dockneel,1650838210,democraticunderground.com,https://www.democraticunderground.com/100216623294,Ukrainians Have a New Word For Russian Fascism,worldnews
Kkim0615,1650838126,france24.com,https://www.france24.com/en/live-news/20220424-relief-not-joy-at-low-key-macron-election-party,"Relief, not joy, at low-key Macron election party",worldnews
dockneel,1650837983,nytimes.com,https://www.nytimes.com/2022/04/22/magazine/ruscism-ukraine-russia-war.html,Ukranians Have A New Work For Russian Fascism,worldnews
Arrow2019x,1650837805,cbc.ca,https://www.cbc.ca/news/world/russia-ukraine-war-1.6429208,Top U.S. officials meet with Zelensky in Ukraine as Russia continues to pound targets,worldnews
dockneel,1650837792,nyti.ms,https://nyti.ms/3rM89fe,Ukrainians Have a New Word For Russian Fascism,worldnews
fishyfishfishyfishy,1650837725,timesofisrael.com,https://www.timesofisrael.com/explosion-heard-near-northern-border-amid-reports-of-rocket-fired-from-lebanon/,Rocket fired from Lebanon at Israel,worldnews
Imaginary_Weekend_74,1650837571,reuters.com,https://www.reuters.com/article/us-france-election-protests/police-teargas-paris-protestors-after-macron-re-elected-idUSKCN2MG0JZ,Police teargas Paris protestors after Macron re-elected,worldnews
PhaedosSocrates,1650837394,youtu.be,https://youtu.be/SuBs_rcFYDs,Newly arrived Ukraine refugees from war zone interview,worldnews
tjuhl,1650837357,uawire.org,https://www.uawire.org/german-company-rheinmetall-asks-berlin-for-permission-to-supply-100-marder-infantry-fighting-vehicles-to-ukraine,German company Rheinmetall asks Berlin for permission to supply 100 Marder infantry fighting vehicles to Ukraine,worldnews
Imaginary_Weekend_74,1650837022,bbc.com,https://www.bbc.com/news/world-europe-61210699,"Odesa missile attack: “My world is destroyed,” says father of baby killed in strike",worldnews
mastoofparty,1650836776,vm.tiktok.com,https://vm.tiktok.com/ZMLpYkbXD/,Ivano Dantonio632 su TikTok,worldnews
Vit0C0rleone,1650836626,abc.net.au,https://www.abc.net.au/news/2022-04-25/ukraine-russia-war-live-putin-mariupol-zelenskyy-kyiv/101012170,"Live: US Secretary of State arrives in Kyiv for talks with Zelenskyy, Ukraine says",worldnews
prixb,1650836516,express.co.uk,https://www.express.co.uk/news/world/1599814/world-war-3-Putin-threat-Europe-World-Nato-countries-Vladimir-Solovyov-Russian-propaganda,"Putin's Tv propagandist has warned of Russia waging a war ""against Europe and the World"" after the invasion of Ukraine, as he said, ""Ukrainians no longer enough"".",worldnews
lahna33,1650836370,nampets.com,https://nampets.com/cat-entered-the-burning-storage-five-instances-and-done-all-five-of-her-kittens/,Cat entered the burning garage five instances and done all five of her kittens,worldnews
prixb,1650835968,express.co.uk,https://www.express.co.uk/news/world/1600013/Russia-nuclear-UK-target-State-TV-Vladimir-Putin-noose-death-threat-Boris-Johnson-news-vn,UK named Putin's 'prime target' as Russia warns it can launch 'nuclear strike' on Britain,worldnews
definitelynotabotact,1650835895,scmp.com,https://www.scmp.com/news/world/europe/article/3175378/voter-turnout-lower-usual-so-far-french-presidential-election?module=lead_hero_story&amp;pgtype=homepage,Marine le Pen concedes defeat to Emmanuel Macron in French election,worldnews
pleasantzones,1650835877,ndtv.com,https://www.ndtv.com/world-news/taliban-says-wont-tolerate-invasions-after-alleged-pak-airstrikes-2916729,"Taliban Says Won't Tolerate ""Invasions"" After Alleged Pakistan Airstrikes",worldnews
prixb,1650835837,apnews.com,https://apnews.com/article/russia-ukraine-zelenskyy-kyiv-business-lloyd-austin-b070518fe13dc3286620d4864dc4cd0c,Ukraine official: Zelenskyy meets top-level US delegation,worldnews
SeeYouHenTee,1650835807,france24.com,https://www.france24.com/en/france/20220424-live-polls-open-across-france-as-macron-and-le-pen-vie-for-french-presidency,"As it happened: Voter abstention at 28% in French presidential run-off, up 2.5% from 2017",worldnews
prixb,1650835743,ctvnews.ca,https://www.ctvnews.ca/politics/russia-s-ambassador-to-canada-says-he-is-on-the-right-side-of-history-1.5873988,Russia's ambassador to Canada says he is 'on the right side of history',worldnews
pleasantzones,1650835703,ndtv.com,https://www.ndtv.com/world-news/taliban-says-wont-tolerate-invasions-after-alleged-pak-airstrikes-2916729,"Taliban Says Won't Tolerate ""Invasions"" After Alleged Pak Airstrikes",worldnews
goodbadidontknow,1650835529,euroweeklynews.com,https://euroweeklynews.com/2022/04/24/siberia-forest-fires-spread-at-unprecedented-rate/,Siberian forests are on fire in Russia. They cannot be extinguished due to a lack of military firefighters - Putin sent them all to war against Ukraine,worldnews
Longwalk4AShortdrink,1650835521,timesofisrael.com,https://www.timesofisrael.com/lapid-reaffirms-israels-official-commitment-to-maintaining-temple-mount-status-quo/,"Lapid continues to uphold policy of ""No non-muslims"" on Temple Mount",worldnews
Kkim0615,1650835421,france24.com,https://www.france24.com/en/video/20220424-replay-france-s-emmanuel-macron-holds-re-election-speech,France's Emmanuel Macron holds re-election speech - France 24,worldnews
prixb,1650835375,apnews.com,https://apnews.com/article/europe-elections-donald-trump-european-union-parliamentary-a984fac1158207c410d5abe164b3925f,"Opposition wins Slovenia vote, defeating right-wing populist",worldnews
Ok_Routine1448,1650835318,apkbaloch.com,https://apkbaloch.com/pubg-mod-apk/,PUBG Mod APK - APK Baloch,worldnews
bogusssssss,1650834983,countercurrents.org,https://countercurrents.org/2022/04/history-returns-again-in-ukraine/,History Returns Again In Ukraine| Countercurrents,worldnews
prixb,1650834672,businessinsider.com,https://www.businessinsider.com/russian-forces-simply-cant-seize-kyiv-former-us-nato-ambassador-2022-4,"Russian forces 'simply can't seize Kyiv' and are 'making it up as they go along,' says former US NATO ambassador",worldnews
alixme,1650834643,rb.gy,https://rb.gy/et7dnn,"Huge blast at illegal oil refinery in Nigeria kills scores of people, including children",worldnews
checkmak01,1650834629,reuters.com,https://www.reuters.com/world/europe/slovenias-populist-pm-faces-close-election-race-against-environmentalist-party-2022-04-23/,Slovenia's populist PM set to lose election to environmentalist party,worldnews
Sweep145,1650834605,newsweek.com,https://www.newsweek.com/hepatitis-outbreak-sees-17-children-needing-liver-transplants-1-dying-who-1700422,"Hepatitis outbreak sees 17 children needing liver transplants, 1 dying: WHO",worldnews
MicroSofty88,1650834079,foxnews.com,https://www.foxnews.com/world/china-promotes-coal-setback-emissions.amp,China promotes coal in setback for efforts to cut emissions,worldnews
alixme,1650834058,rb.gy,https://rb.gy/fav0sz,"Woman's impending execution sparks rare bipartisan agreement, rallies in her support",worldnews
wolfsog23,1650834031,apnews.com,https://apnews.com/article/b070518fe13dc3286620d4864dc4cd0c,Ukraine official: Zelenskyy meets top-level US delegation,worldnews
today_and_tomorrow,1650833941,9news.com.au,https://www.9news.com.au/world/france-election-macron-vs-le-pen-votes-in-tense-presidential-runoff/42c09d5f-bd6e-4713-8631-3649d4779a6e,Democracy wins': France's Macron is re-elected,worldnews
oooeeeoooKillerTofu,1650833827,mobile.twitter.com,https://mobile.twitter.com/vmsalama/status/1518266505691029506,US holds one sanctions card close to the vest: Vladimir Putin's alleged girlfriend &amp; mother of at least 3 of his kids. Officials tell us they made an 11th hour decision to hold off on sanctioning Alina Kabaeva because the move is escalatory.,worldnews
oooeeeoooKillerTofu,1650833764,mobile.twitter.com,https://mobile.twitter.com/vmsalama/status/1518266505691029506,"U.S. Withholds Sanctions on a Very Close Putin Associate: His Reputed Girlfriend Officials have a sanctions package ready, but they continue to weigh the potential backlash for blacklisting the 39-year-old former Olympic gymnast",worldnews
superanth,1650833694,theguardian.com,http://theguardian.com/world/2022/apr/24/dozens-bucha-civilians-killed-flechettes-metal-darts-russian-artillery,Dozens of Bucha civilians were killed by metal darts from Russian artillery,worldnews
oooeeeoooKillerTofu,1650833481,wsj.com,https://www.wsj.com/articles/u-s-withholds-sanctions-on-a-very-close-putin-associate-his-alleged-girlfriend-11650816894,"U.S. Withholds Sanctions on a Very Close Putin Associate: His Reputed Girlfriend Officials have a sanctions package ready, but they continue to weigh the potential backlash for blacklisting the 39-year-old former Olympic gymnast",worldnews
bogusssssss,1650833406,reuters.com,https://www.reuters.com/world/russia-investigates-media-report-presence-british-sas-special-forces-ukraine-2022-04-23/,Russia investigates media report on presence of British SAS special forces in Ukraine,worldnews
_EnlightenedCentrist,1650833392,wsj.com,https://www.wsj.com/articles/twitter-re-examines-elon-musks-bid-may-be-more-receptive-to-a-deal-11650822932,"Twitter Re-Examines Elon Musk’s Bid, May Be More Receptive to a Deal",worldnews
Brandonrogerreal,1650833391,fertune.blogspot.com,https://fertune.blogspot.com/2022/04/people-with-opinions-whats-pettiest.html,"People With Opinions, What's The Pettiest Hill You're Willing To Die On?",worldnews
pokeoem,1650833271,reuters.com,https://www.reuters.com/world/europe/leaders-quick-congratulate-frances-macron-relief-europe-2022-04-24/,European leaders quick to congratulate France's Macron in EU sigh of relief,worldnews
godnins,1650833126,businessinsider.com,https://www.businessinsider.com/united-nations-wants-immediate-ceasefire-mariupol-to-evacuate-wounded-civilians-2022-4?utm_source=feedly&amp;utm_medium=webfeeds,United Nations calls for an 'immediate stop' to fighting in Mariupol amid urgent need to evacuate 'hundreds of wounded' civilians,worldnews
Lionel54321,1650833045,theguardian.com,https://www.theguardian.com/world/2022/apr/24/opposition-slovenian-liberal-party-on-course-for-landslide-win-say-exit-polls,"Opposition Slovenian liberal party on course for landslide win, say exit polls | Slovenia",worldnews
eyeoftheotter,1650832741,reuters.com,https://www.reuters.com/world/europe/down-not-out-frances-le-pen-vows-fight-2022-04-24/,Down but not out: France's Le Pen vows to fight on,worldnews
No-Energy5226,1650832545,opensea.io,https://opensea.io/assets/0x495f947276749ce646f68ac8c248420045cb7b5e/98287570310740400983165580679628083047434201041019887271747546292848678666241/,SLAVA UKRAINE - real face of Putin - Untitled Collection #316611991,worldnews
titukaka,1650832539,teslanorth.com,https://teslanorth.com/2022/04/24/u-k-proposal-to-allow-watching-tv-in-self-driving-cars/,U.K. Proposal to Allow Watching TV in Self-Driving Cars,worldnews
Jamie_Pull_That_Up,1650832230,google.com,https://www.google.com/amp/s/www.aljazeera.com/amp/news/2022/4/12/ukraines-zelenskyy-requests-address-with-africa-union,"Ukraine’s Zelenskyy requests address with Africa Union | Kyiv could be seeking to court African countries, which have mostly stayed neutral or muted in condemnation of Russia.",worldnews
molokoplus359,1650831816,ft.com,https://www.ft.com/content/a16c4ecd-e835-4e71-a12d-c7bec9f34d7c,Putin abandons hopes of Ukraine deal and shifts to land-grab strategy,worldnews
HungariansBestFriend,1650831733,foxnews.com,https://www.foxnews.com/politics/biden-armenian-genocide-stop-atrocities,"Bidən marks 'Armenian genocide,' aims to stop 'atrocities'",worldnews
Comfortable-Stop-533,1650831597,nbcnews.com,https://www.nbcnews.com/news/amp/rcna25692,So why can’t two independent countries sign a security pack without being warned by a third one (the US).,worldnews
HungariansBestFriend,1650831481,uk.news.yahoo.com,https://uk.news.yahoo.com/biden-marks-armenian-genocide-aims-182831322.html,Biden marks 'Armenian genocide' and aims to stop 'atrocities',worldnews
Gatitobonito2022,1650831400,flimbeer.com,http://www.flimbeer.com,Last viral news😳,worldnews
HungariansBestFriend,1650831323,voanews.com,https://www.voanews.com/a/biden-marks-armenian-genocide-aims-to-stop-atrocities-/6542838.html,"Biden Marks 'Armenian Genocide,' Aims to Stop 'Atrocities'",worldnews
Whatisgoingonherelad,1650831132,apnews.com,https://apnews.com/article/europe-elections-donald-trump-european-union-parliamentary-a984fac1158207c410d5abe164b3925f,Exit polls show opposition winning Slovenian election,worldnews
Vit0C0rleone,1650830969,theguardian.com,https://www.theguardian.com/world/2022/apr/24/dozens-bucha-civilians-killed-flechettes-metal-darts-russian-artillery,Dozens of Bucha civilians were killed by metal darts from Russian artillery | Ukraine,worldnews
Kkim0615,1650830958,france24.com,https://www.france24.com/en/europe/20220424-european-leaders-congratulate-macron-on-re-election,European leaders congratulate Macron on re-election,worldnews
Usergoogl88888,1650830798,google.com,http://google.com/maxixes,Maxixes cured baldness,worldnews
Naive-Lime3880,1650830746,worldanimalnews.com,https://worldanimalnews.com/congress-introduces-legislation-to-ban-barbaric-wildlife-killing-contests-on-more-than-500-million-acres-of-public-land-in-the-united-states/,U.S. Congress Introduces Legislation To Ban Barbaric Wildlife Killing Contests On More Than 500 Million Acres Of Public Land,worldnews
Usergoogl88888,1650830645,images.app.goo.gl,https://images.app.goo.gl/WnLteibZhjbJb3wQ8,Maxixes cured baldness,worldnews
today_and_tomorrow,1650830486,localnews8.com,https://localnews8.com/news/national-world/cnn-europe-mideast-africa/2022/04/24/emmanuel-macron-will-win-frances-presidential-election-pollsters-project/,Emmanuel Macron will win France’s presidential election,worldnews
bakert12,1650830280,reuters.com,https://www.reuters.com/world/europe/macron-or-le-pen-france-faces-stark-choice-president-2022-04-24/,"France's Macron wins re-election, dodges political earthquake",worldnews
today_and_tomorrow,1650830268,usnews.com,https://www.usnews.com/news/world/articles/2022-04-24/police-teargas-paris-protestors-after-macron-re-elected,Police Teargas Paris Protestors After Macron Re-Elected,worldnews
Ukraina_Novosti,1650830139,tsn.ua,https://tsn.ua/en/ato/there-are-food-shortages-in-the-world-already-due-to-the-war-in-ukraine-the-uk-imposed-a-series-of-limits-on-cooking-oil-2045296.html,There are food shortages in the world already due to the war in Ukraine: the UK imposed a series of limits on cooking oil,worldnews
Brandonrogerreal,1650829779,fertune.blogspot.com,https://fertune.blogspot.com/2022/04/people-are-sharing-worst-movies-they.html,"People Are Sharing The Worst Movies They Couldn't Even Finish, And There Are Some Deeply Controversial Takes Here",worldnews
Digital_Brand,1650829694,bbc.com,https://www.bbc.com/news/world-europe-61209765,French election: Historic win but Macron has polarised France,worldnews
gaukonigshofen,1650829690,yahoo.com,https://www.yahoo.com/news/ukrainian-refugees-queue-food-wealthy-140531148.html,Ukrainian refugees queue for food in wealthy Switzerland,worldnews
[deleted],1650829604,washingtonpost.com,https://www.washingtonpost.com/business/energy/have-britains-tories-been-in-power-too-long/2022/04/24/eaf5b7c2-c393-11ec-b5df-1fba61a66c75_story.html,Have Britain’s Tories Been in Power Too Long?,worldnews
Sure-Video8835,1650829478,youtube.com,https://youtube.com/watch?v=bht2XRP8lM0&amp;feature=share,Emmanuel Macron re-elected President of the French Republic 🇫🇷 with 58.8...,worldnews
bhuddistchipmonk,1650829403,camera.org,https://www.camera.org/article/muna-el-kurd-jews-are-zionist-dogs-and-palestine-should-be-ethnically-cleansed-of-them/,"Muna El-Kurd: Jews are Zionist Dogs, and ‘Palestine’ Should Be Ethnically Cleansed of Them",worldnews
Sensitive-Airport-99,1650829247,medium.com,https://medium.com/@nocorruptionineducation/sands-national-academy-financing-terrorism-money-laundering-human-trafficking-academic-fraud-8a5c62b83dff,Medium,worldnews
aka_KyZa,1650828919,pravda.com.ua,https://www.pravda.com.ua/eng/news/2022/04/24/7341811/,Russian Orthodox Church facilitates forced deportation of Ukrainians to Russia – investigation,worldnews
moneycentralng,1650828699,moneycentral.com.ng,https://moneycentral.com.ng/sport/article/tyson-fury-defeats-dillian-whyte-by-tko/,"Tyson Fury landed the best punch of his career to defend the sport’s most treasured prize. The defending lineal/WBC champion from Manchester, England remained unbeaten and still king of the heavyweight division following a sixth-round knockout of countryman and mandatory challenger Dillian",worldnews
scot816,1650828451,euronews.com,https://www.euronews.com/2022/04/23/russian-economy-feels-consequences-of-sanctions-despite-kremlin-s-denial,Russian economy suffers sanctions blow despite Kremlin's denial,worldnews
today_and_tomorrow,1650828179,ctvnews.ca,https://www.ctvnews.ca/world/russian-sanctions-prove-canadian-military-mission-in-ukraine-had-impact-commander-1.5874102,Russian sanctions prove Canadian military mission in Ukraine had impact,worldnews
eldashev,1650827985,ukrinform.net,https://www.ukrinform.net/rubric-ato/3466423-russia-has-used-up-about-70-of-its-highprecision-missiles-since-warstart-bellingcat.html,Russia has used up about 70% of its high-precision missiles since war-start - Bellingcat,worldnews
Diadochiofalexandros,1650827380,bbc.com,https://www.bbc.com/news/blogs-trending-61176372,Ukraine war: How a school survivor became a target of Russian disinformation,worldnews
Ifukbull,1650827283,cbc.ca,https://www.cbc.ca/news/health/children-hospitals-covid-canada-6th-wave-1.6427675,Children’s hospitals under strain in Canada’s 6th COVID-19 wave,worldnews
eldashev,1650827264,reuters.com,https://www.reuters.com/world/europe/view-frances-macron-beats-le-pen-win-second-term-2022-04-24/,Macron beats Le Pen: Market reaction,worldnews
itsemonbd,1650827054,bbc.com,https://www.bbc.com/news/world-europe-61195923,David Nott: The war surgeon helping doctors save lives in Ukraine,worldnews
