author,created_utc,domain,url,title,subreddit
prixb,1650555113,apnews.com,https://apnews.com/article/russia-ukraine-zelenskyy-biden-mark-rutte-justin-trudeau-e78a7db76215a84f86586bb56122cd04,Biden announces $800M in new military assistance for Ukraine,worldnews
Opposite_Fish_9084,1650555057,youtu.be,https://youtu.be/LOSQvdLdZ-g,How good or bad are European public opinion of China after Covid-19 period?EU-China Opinion Conflict,worldnews
JunketTechnical4516,1650555022,crackplan.com,https://crackplan.com/easeus-todo-backup-crack/,EaseUS Todo Backup 13.5.0 Crack 2022 With Activation Code Windows,worldnews
prixb,1650554991,newsweek.com,https://www.newsweek.com/russia-ukraine-belarus-lukashenko-minsk-1699643,Russia Planned Invasion of Belarus in 2020—Ukraine Intelligence Leak Says,worldnews
JunketTechnical4516,1650554794,crackplan.com,https://crackplan.com/camtasia-studio-crack/,Camtasia Studio 2022.0.15 Crack &amp; Keygen [2022] Latest Free,worldnews
fishyfishfishyfishy,1650554733,timesofisrael.com,https://www.timesofisrael.com/hamas-calls-for-palestinian-mobilization-ahead-of-fridays-al-aqsa-prayers/,Hamas calls for Palestinian 'mobilization' ahead of Friday's Al-Aqsa prayers,worldnews
jivatman,1650554705,usnews.com,https://www.usnews.com/news/world/articles/2022-04-21/iran-has-rejected-u-s-offers-to-lift-sanctions-in-exchange-for-tehran-abandoning-soleimani-revenge-isna-quotes-guards-navy-commander,Iran Has Rejected U.S. Offers to Lift Sanctions in Exchange for Tehran Abandoning Soleimani Revenge - ISNA Quotes Guards Navy Commander,worldnews
JunketTechnical4516,1650554644,crackplan.com,https://crackplan.com/malwarebytes-crack-free/,Malwarebytes 4.5.5.279 Crack With Keygen [Lifetime] Full Download,worldnews
Ice_Burn,1650554629,thehill.com,https://thehill.com/news/3275701-ex-honduran-president-to-be-extradited-to-us-to-face-drug-charges/,Ex-Honduran president to be extradited to US to face drug charges,worldnews
JunketTechnical4516,1650554517,crackplan.com,https://crackplan.com/ashampoo-pdf-pro-crack/,Ashampoo PDF Pro 3.0.2 Crack Serial Key 2022 Latest Full Download,worldnews
kioeerj,1650554498,reuters.com,https://www.reuters.com/world/russia-is-failing-ukraine-top-us-official-says-2022-04-21/,"Russia is failing in Ukraine, top U.S. official says",worldnews
CaliWilly76,1650554471,businessinsider.com,https://www.businessinsider.com/ukraine-says-kadyrov-troops-killed-russia-soldiers-refuse-fight-2022-4,Ukraine: Kadyrov Troops Killed Russian Soldiers for Refusing to Fight,worldnews
JunketTechnical4516,1650554374,windowsbay.com,https://windowsbay.com/windows-server-crack/,"Windows Server 2022 R2 Crack With Activation Key, Product Key Latest",worldnews
caj_gol,1650554284,cnn.com,https://www.cnn.com/2022/04/21/politics/puerto-rico-supreme-court-federal-disability-benefits/index.html,Supreme Court rules Puerto Ricans don't have constitutional right to some federal benefits | CNN Politics,worldnews
JunketTechnical4516,1650554215,windowsbay.com,https://windowsbay.com/mainstage-crack/,MainStage 3.5.3 Crack Serial Key Full Free Download (2022),worldnews
OldFashionedJizz,1650554148,commondreams.org,https://www.commondreams.org/news/2022/04/21/civilians-trapped-putin-orders-russian-forces-blockade-last-mariupol-holdout,Civilians Trapped as Putin Orders Russian Forces to Blockade Last Mariupol Holdout - Ukrainian officials called for a humanitarian corridor to allow civilians to escape and accused Russian forces of committing war crimes in the city.,worldnews
JunketTechnical4516,1650554092,windowsbay.com,https://windowsbay.com/lockwiper-crack/,iMyFone LockWiper 7.5.2 Crack Keygen With Full Latest Software 2022,worldnews
Ancient_Glass1736,1650554002,strawpoll.com,https://strawpoll.com/polls/jVyGJaz2GZ7,Rock Battle torsdag 21/4,worldnews
Lucie7571,1650554002,t.me,https://t.me/+YNTp-ORKrRRiZjJk,"My last paycheck was $14709 working 20 hours a week online. My friend has been averaging 15k for months now and he works about 20 hours a week. I can't believe how easy it was once I tried it out. And i can proudly tell you today that it all went well ,you can start earning today ✔️",worldnews
JunketTechnical4516,1650553972,windowsbay.com,https://windowsbay.com/freemake-video-converter-gold-crack/,Freemake Video Converter Gold 4.1.14.21 Crack With Activation Key2022,worldnews
CaliWilly76,1650553845,insider.com,https://www.insider.com/yamatoq-leader-arrested-on-suspicion-of-breaking-into-vaccine-clinic-2022-4,YamatoQ Leader Arrested on Suspicion of Breaking Into Vaccine Clinic,worldnews
Dru_Montana,1650553812,youtu.be,https://youtu.be/bgfssq6vt3Q,Russian comedians discuss the comedy scene during times of war,worldnews
JunketTechnical4516,1650553800,windowsbay.com,https://windowsbay.com/driver-toolkit-crack/,Driver Toolkit 8.9 License Key Crack Full 100% Working,worldnews
SILVESTRINO,1650553771,pressenza.com,https://www.pressenza.com/2022/04/european-referendum-on-ukraine-war-how-many-europeans-want-war-rearmament-and-nuclear-power/,"European referendum on Ukraine war: how many Europeans want war, rearmament and nuclear power?",worldnews
Dr_HiZy,1650553751,musicnewsfirst.com,https://musicnewsfirst.com/the-lawyer-announced-the-detention-of-a-man-on-theater-square-because-of-blue-and-yellow-sneakers/,"Russian man was detained and fined 10,000 rubles for wearing blue and yellow sneakers",worldnews
Jagielonian,1650553653,foreignpolicy.com,https://foreignpolicy.com/2022/04/20/germany-refugee-policy-afghanistan-ukraine/,Germany Is Displacing Afghan Refugees to Make Way for Ukrainians,worldnews
foxwolflion,1650553639,reuters.com,https://www.reuters.com/world/ethiopians-queue-up-volunteer-russias-fight-ukraine-2022-04-21/,Ethiopians queue up to volunteer for Russia's fight in Ukraine,worldnews
foxwolflion,1650553584,reuters.com,https://www.reuters.com/business/media-telecom/russia-fines-google-over-youtube-fakes-tass-2022-04-21/,"Russia fines Google over Ukraine 'fakes';, far-right content - TASS",worldnews
foxwolflion,1650553466,theguardian.com,https://www.theguardian.com/world/2022/apr/21/ukrainian-holocaust-survivor-91-dies-during-mariupol-siege,"Ukrainian Holocaust survivor, 91, dies during Mariupol siege | Ukraine",worldnews
prixb,1650553384,newsweek.com,https://www.newsweek.com/ukraine-invasion-us-russia-china-nuclear-cold-war-1699626,More Than 4 in 5 Russians Fear Nuclear War With U.S. —Poll,worldnews
070420210854,1650553292,brownstone.org,https://brownstone.org/articles/the-world-catastrophe-wrought-by-covid-lockdowns/,The World Catastrophe Wrought by Covid Lockdowns,worldnews
Flat_Carrot_5613,1650553280,youtu.be,https://youtu.be/p3b92XG6sjk,"مشاهدة ""Careless Whisper/George - Michae/♊🇮🇶Bablony Iraq"" على YouTube",worldnews
OnlyBluePie,1650553248,cnbc.com,https://www.cnbc.com/2022/04/21/us-sends-800-million-arms-package-to-ukraine.html,US to send an additional $800 million to Ukraine,worldnews
OnlyBluePie,1650553163,google.com,https://www.google.com/amp/s/www.cnbc.com/amp/2022/04/21/us-sends-800-million-arms-package-to-ukraine.html,US to send $800 million to Ukraine,worldnews
Inside_Worker7352,1650553052,reuters.com,https://www.reuters.com/world/europe/zelenskiy-says-visit-moscow-out-question-right-now-report-2022-04-21/,Zelenskiy says visit to Moscow 'out of the question' right now' - report,worldnews
scot816,1650552997,cbsnews.com,https://www.cbsnews.com/live-updates/biden-ukraine-military-aid-artillery-ammunition-watch-live-stream-today-2022-04-21/,Biden announces new $800 million round of military aid to Ukraine,worldnews
Portalrules123,1650552978,cbc.ca,https://www.cbc.ca/news/canada/montreal/montrealer-among-plane-crash-victims-haiti-1.6425755,"Montreal family suffers double-tragedy after father dies in plane crash, son in ferris wheel accident",worldnews
LawrenceOnKeyboard,1650552921,abcnews.go.com,https://abcnews.go.com/Politics/biden-announce-800m-aid-package-ukraine-russia-presses/story?id=84194608,Biden announces new $800M aid package to Ukraine as Russia presses offensive,worldnews
LawrenceOnKeyboard,1650552835,washingtonpost.com,https://www.washingtonpost.com/politics/biden-set-to-announce-new-military-assistance-for-ukraine/2022/04/21/dfc0059a-c129-11ec-b5df-1fba61a66c75_story.html,Biden announces $800M in new military assistance for Ukraine,worldnews
WouldbeWanderer,1650552752,npr.org,https://www.npr.org/2022/04/19/1092793826/russian-invasion-upends-young-flourishing-ukrainian-publishing-industry,"Russian invasion upends young, flourishing Ukrainian publishing industry",worldnews
Transistor4aCPU,1650552752,spiegel.de,https://www.spiegel.de/politik/deutschland/ukraine-krieg-bundesregierung-plant-mit-slowenien-ringtausch-fuer-lieferung-schwerer-waffen-a-df562353-f143-415c-add2-5b0607be2171,Germany plans ring swap with Slovenia for delivery of heavy weapons to Ukraine,worldnews
Roma02121,1650552731,m.jpost.com,https://m.jpost.com/breaking-news/article-704747,Iran claims it caught 3 Mossad spies in southeast of country,worldnews
JunketTechnical4516,1650552659,windowsbay.com,https://windowsbay.com/neat-video-crack/,Neat Video 5.4.5 Crack License Key With Patch Premiere Lifetime,worldnews
prixb,1650552556,newsweek.com,https://www.newsweek.com/russian-tv-panel-laughs-while-discussing-nuclear-strikes-against-us-1699684,Russian TV Panel Laughs While Discussing Nuclear Strikes Against the U.S.,worldnews
JunketTechnical4516,1650552512,newactivators.com,https://newactivators.com/marvelous-designer-crack/,Marvelous Designer 11 Crack Free Download 2022,worldnews
Pet1003,1650552387,cnbc.com,https://www.cnbc.com/2022/04/21/musk-to-explore-potential-tender-offer-for-twitter-has-46point5b-in-committed-financing-for-potential-deal.html,"Musk to explore potential tender offer for Twitter, has $46.5B in committed financing for deal",worldnews
JunketTechnical4516,1650552286,newactivators.com,https://newactivators.com/topaz-sharpen-ai-crack/,Topaz Sharpen AI 3.3.5 Crack Full Download 2022,worldnews
OGistorian,1650552243,nbcnews.com,https://www.nbcnews.com/news/amp/rcna25328,Biden commits additional aid to Ukraine as Russia declares 'success' in Mariupol.,worldnews
kalianes,1650552088,msn.com,https://www.msn.com/en-us/news/world/biden-announces-new-ukraine-security-assistance/ar-AAWrIDU?ocid=EMMX&amp;cvid=5e91a7d9c9bc43a4a46921a17d33b4fb,Biden announces new Ukraine security assistance: 'We will speak softly and carry a large javelin',worldnews
gridnews,1650551981,grid.news,https://www.grid.news/story/global/2022/04/19/who-has-the-advantage-in-the-war-for-eastern-ukraine/,Who has the advantage in the war for eastern Ukraine?,worldnews
boomership,1650551872,yle.fi,https://yle.fi/news/3-12411892,"APN podcast: No, Russia is not ""moving equipment to the Finnish border""",worldnews
gridnews,1650551789,grid.news,https://www.grid.news/story/global/2022/04/19/who-has-the-advantage-in-the-war-for-eastern-ukraine/,Who has the advantage in the war for eastern Ukraine?,worldnews
TanzaniaTech,1650551402,tanzaniatech.one,https://www.tanzaniatech.one/2022/04/tuzo-za-muundo-bora/,TECNO Camon 19 Pro na Phantom X Zashinda Tuzo Za Muundo Bora,worldnews
[deleted],1650551367,theguardian.com,https://www.theguardian.com/world/2022/apr/21/ukrainian-holocaust-survivor-91-dies-during-mariupol-siege,"Ukrainian Holocaust survivor, 91, dies during Mariupol siege",worldnews
Monk2020,1650551177,bbc.com,https://www.bbc.com/news/world-asia-61174991,Afghanistan: Dozens dead and injured in four blasts,worldnews
manticor225,1650551081,reuters.com,https://www.reuters.com/world/europe/latvian-estonian-parliaments-say-russia-committed-genocide-ukraine-2022-04-21/,Latvian and Estonian parliaments vote unanimously to declare that Russia committed genocide in Ukraine,worldnews
prixb,1650551004,reuters.com,https://www.reuters.com/world/ethiopians-queue-up-volunteer-russias-fight-ukraine-2022-04-21/,Ethiopians queue up to volunteer for Russia's fight in Ukraine,worldnews
Accomplished_Water34,1650550924,reddit.com,https://www.reddit.com/r/ukraine/comments/u8offq/another_view_of_the_fire_in_tver_russia_of_the/?utm_medium=android_app&amp;utm_source=share,MoD Building in Russia. The roof is on fire.,worldnews
OpportunityNo4303,1650550882,usnews.com,https://www.usnews.com/news/world/articles/2022-04-20/japan-pm-kishida-sends-offering-to-controversial-shrine-for-war-dead?context=amp,"China, South Korea Protest Over Japanese PM's Offering to War Dead",worldnews
Prunestand,1650550823,theguardian.com,https://www.theguardian.com/world/2022/apr/21/zero-dark-thirty-ex-cia-agent-alfreda-scheuer,‘I don’t regret it’: ex-CIA agent who inspired Zero Dark Thirty defends waterboarding | Al-Qaida,worldnews
Bloke22,1650550787,ukdefencejournal.org.uk,https://ukdefencejournal.org.uk/british-nuclear-submarine-loads-up-on-tomahawk-cruise-missiles/,British nuclear submarine seen loading up on Tomahawk cruise missiles in Gibraltar base,worldnews
Flosgisyth,1650550744,hindustantimes.com,https://www.hindustantimes.com/world-news/afghanistan-isis-claims-responsibility-for-mazar-e-sharif-mosque-blast-killing-10-101650543445032.html,ISIS claims responsibility for Mazar-e-Sharif mosque blast killing 10,worldnews
kipller,1650550741,businessinsider.com,https://www.businessinsider.com/2-russian-oligarchs-found-dead-spain-moscow-reports-2022-4?utm_source=feedly&amp;utm_medium=webfeeds,"2 Russian oligarchs were found dead one day apart alongside their wives and children, reports say",worldnews
fatchary,1650550727,scientificamerican.com,https://www.scientificamerican.com/article/ai-drug-discovery-systems-might-be-repurposed-to-make-chemical-weapons-researchers-warn/,"AI Drug Discovery Systems Might Be Repurposed to Make Chemical Weapons, Researchers Warn",worldnews
9viller,1650550594,scroll.in,https://scroll.in/article/1022256,"Muslims, in India, now face restrictions on food, clothes, marriage, prayer, jobs, healthcare, housing, many of these legitimised by a law, administrative action or court ruling.",worldnews
Volodymyr_zelenskii,1650550430,nippon.com,https://www.nippon.com/en/news/yjj2022042100448/india-rejects-japan-sdf-aircraft-for-ukraine-aid.html,India Rejects Japan SDF Aircraft for Ukraine Aid,worldnews
viraltrendingnewsxyz,1650550234,viraltalkies.online,https://viraltalkies.online/tony-spell-net-worth/,tony spell net worth,worldnews
opeifu,1650550175,reuters.com,https://www.reuters.com/world/us-give-ukraine-another-500-mln-keep-government-running-treasury-2022-04-21/,U.S. to give Ukraine another $500 mln to keep government running -Treasury,worldnews
kioeerj,1650550108,reuters.com,https://www.reuters.com/world/us/biden-ban-russian-affiliated-ships-us-ports-sources-2022-04-21/,Biden to ban Russian-affiliated ships from U.S. ports,worldnews
smcnabbdxv,1650550106,getrevue.co,https://www.getrevue.co/profile/gdtvhazza/issues/china-optimized-covid-19-measures-i-translate-you-connect-the-dots-1138638,"China: Optimized COVID-19 measures (I translate, you connect the dots)",worldnews
kalianes,1650550085,edition.cnn.com,https://edition.cnn.com/2022/04/21/business/lukoil-ceo-alekperov-resigns/index.html,The head of Russia's second biggest oil company has quit,worldnews
The_Food_Scientist,1650549952,surinenglish.com,https://www.surinenglish.com/spain/sanchez-announces-shipment-20220421153105-nt.html,"Spain will reopen its embassy in Kyiv, it will send over 50 forensic experts to investigate war crimes in Ukraine.",worldnews
ramammu,1650549938,youtu.be,https://youtu.be/SRIEA47Rwio,"One of the great vegetables is mango, uses | how to and for what to eat mango | how mango used as medicine to us | how eat green mango",worldnews
Winterisbucky,1650549892,tribune.com.pk,https://tribune.com.pk/story/2353562/us-values-its-ties-with-pakistan-ilhan-omar,US values its ties with Pakistan: Ilhan Omar | The Express Tribune,worldnews
Nicolelaurelln,1650549476,go2affm.com,https://go2affm.com/c/?p=18316&amp;o=9819&amp;s1=as,Get your $250 Gas Card now!,worldnews
JencyJane,1650549456,us.sganalytics.com,https://us.sganalytics.com/blog/social-media-trends-to-watch-out-for-in-2022/,Effective Social Media Trends 2022 announced,worldnews
ManusTheVantablack,1650549361,khaleejtimes.com,https://www.khaleejtimes.com/tennis/djokovic-slams-crazy-wimbledon-ban-on-russian-belarusian-players-over-ukraine-conflict,"Djokovic slams 'crazy' Wimbledon ban on Russian, Belarusian players over Ukraine conflict",worldnews
kipller,1650549333,msn.com,https://www.msn.com/en-us/news/world/us-to-welcome-ukraine-refugees-but-no-longer-through-mexico/ar-AAWrVHj?ocid=EMMX&amp;cvid=e94fd06b7d1f446ab518ef54741ca8be,US to welcome Ukraine refugees but no longer through Mexico,worldnews
rhappam345,1650549258,caymancompass.com,https://www.caymancompass.com/2022/04/20/could-caymans-financial-sector-help-save-the-planet/,Could Cayman's financial sector help save the planet?,worldnews
dilettantedebrah,1650549257,taiwannews.com.tw,https://www.taiwannews.com.tw/en/news/4514152,"Taiwan test-fires missiles on east, west coasts",worldnews
dilettantedebrah,1650549075,japantoday.com,https://japantoday.com/category/politics/japan-gov't-weighs-cash-handouts-for-low-income-families'-children,"Japanese Gov't weighs ¥50,000 cash handouts for low-income families' children",worldnews
dilettantedebrah,1650548976,japantoday.com,https://japantoday.com/category/world/uk's-pm-arrives-in-india-for-hard-sell-on-anti-russia-action,British PM Johnson arrives in India for hard sell on anti-Russia action,worldnews
rhappam345,1650548946,caymancompass.com,https://www.caymancompass.com/2022/04/20/barbados-prime-minister-lashes-out-at-international-anti-money-laundering-regime/,Barbados prime minister lashes out at international anti-money laundering regime,worldnews
Glittering-Ad-4159,1650548944,mediarunsearch.co.uk,https://www.mediarunsearch.co.uk/ukrainian-workers-are-leaving-modern-slave-conditions-on-uk-farms/,Ukrainian workers are leaving 'modern slave' conditions on UK farms,worldnews
DataCrusade1999,1650548890,hindustantimes.com,https://www.hindustantimes.com/india-news/she-may-practice-narrow-minded-politics-at-home-but-mea-on-ilhan-omar-s-pok-visit-101650542874399.html,‘She may practice her politics at home but…’: India on Ilhan Omar's Pakistan administered Kashmir visit,worldnews
Coolguy4u1,1650548826,viraltalkies.online,https://viraltalkies.online/tony-spell-net-worth/,Tony Spell Net Worth,worldnews
DataCrusade1999,1650548776,indianexpress.com,https://indianexpress.com/article/india/ilhan-omar-pok-visit-india-reactions-7880538/,‘Narrow-minded politics’: India condemns US Congresswoman Ilhan Omar’s visit to Pakistan administered Kashmir,worldnews
[deleted],1650548701,wionews.com,https://www.wionews.com/india/maldives-takes-strong-action-against-anti-india-campaigns-472666,Maldives takes strong action against anti-India campaigns,worldnews
throwawaynumber53,1650548696,cbsnews.com,https://www.cbsnews.com/news/ukraine-refugee-sponsorship-program-us-resettlement/,"U.S. unveils sponsorship program to resettle Ukrainian refugees, discourage travel to U.S.-Mexico border",worldnews
dilettantedebrah,1650548651,hungarytoday.hu,https://hungarytoday.hu/hungarian-malls-bomb-alert-threat-scare-putin-ukrainian-war-email-message/,Shopping Mall Bomb Alert: Unknown Perpetrator Wanted to Send Message to Putin Supporters in Hungary,worldnews
cyberpunk6066,1650548576,edition.cnn.com,https://edition.cnn.com/2022/04/20/economy/germany-inflation-producer-prices-record/index.html,This measure of German inflation just hit its highest level since 1949,worldnews
franceslouise,1650548543,dailyrecord.co.uk,https://www.dailyrecord.co.uk/entertainment/piers-morgan-slams-donald-trump-26761520,Piers Morgan slams Donald Trump as 'ridiculous' on Lorraine Kelly show,worldnews
molokoplus359,1650548147,thetimes.co.uk,https://www.thetimes.co.uk/article/russian-soldiers-celebrate-birthday-of-comrade-and-friend-hitler-lpvm56xz0?utm_medium=Social&amp;utm_source=Twitter#Echobox=1650545873,Russian soldiers celebrate birthday of ‘comrade and friend’ Hitler,worldnews
Atmalamgirkabir100,1650548067,googlesus.com,https://googlesus.com/national-kindergarten-day-april-21-2022/,"National Kindergarten Day - April 21, 2022",worldnews
Nicolelaurelln,1650547970,go2affm.com,https://go2affm.com/c/?p=18316&amp;o=9819&amp;s1=as,Get your $250 Gas Card now!,worldnews
salientlife93,1650547853,aljazeera.com,https://www.aljazeera.com/news/2022/4/21/russia-says-all-of-mariupol-liberated-apart-from-azovstal-plant,"Russia says Mariupol ‘liberated’, apart from Azovstal steel plant",worldnews
PGamerX,1650547835,bloombergquint.com,https://www.bloombergquint.com/markets/china-buys-cheap-coking-coal-from-russia-as-world-shuns-moscow?utm_campaign=fullarticle&amp;utm_medium=referral&amp;utm_source=inshorts,China Buys Cheap Russian Coking Coal as World Shuns Moscow,worldnews
kipller,1650547740,edition.cnn.com,https://edition.cnn.com/2022/04/21/business/india-tata-steel-infosys-stops-russia-business-hnk-intl/index.html,Some big Indian businesses are joining the exodus from Russia,worldnews
PGamerX,1650547707,reuters.com,https://www.reuters.com/business/indias-tata-steel-stop-doing-business-with-russia-2022-04-20/?utm_campaign=fullarticle&amp;utm_medium=referral&amp;utm_source=inshorts,India's Tata Steel to stop doing business with Russia,worldnews
Nicolelaurelln,1650547701,go2affm.com,https://go2affm.com/c/?p=18316&amp;o=9819&amp;s1=as,Get your $250 Gas Card now!,worldnews
Greatfool19000,1650547599,unherd.com,https://unherd.com/2022/04/passover-in-wartorn-odessa/,Passover in war-torn Odessa,worldnews
Havvocck2,1650547551,apnews.com,https://apnews.com/article/russia-ukraine-putin-kyiv-business-europe-f0e1cd893715eda1e6bef696d9c47db3?user_email=8d2bb3f6915a4b121af58297ef9e672c3fe301e394f19818ec14b2ac633f4f45&amp;utm_source=Sailthru&amp;utm_medium=email&amp;utm_campaign=April21_MorningWire&amp;utm_term=Morning%20Wire%20Subscribers,Putin claims Mariupol win but won't storm Ukrainian holdout,worldnews
PGamerX,1650547446,businessinsider.com,https://www.businessinsider.com/negotiating-with-putin-like-dealing-with-crocodile-boris-johnson-2022-4?amp=&amp;utm_campaign=fullarticle&amp;utm_medium=referral&amp;utm_source=inshorts,Negotiating with Putin like dealing with 'crocodile': Boris Johnson,worldnews
foxwolflion,1650547390,ndtv.com,https://www.ndtv.com/world-news/russia-ukraine-war-ukraine-civilians-9-bodies-found-near-kyiv-some-with-signs-of-totrure-ukraine-police-2906316,"9 Bodies Found Near Ukraine's Kyiv, Some ""With Signs Of Torture"": Police",worldnews
PGamerX,1650547370,hindustantimes.com,https://www.hindustantimes.com/world-news/russia-warns-mariupol-residents-to-wear-white-ribbons-or-get-shot-says-mayor-report-101650525958002-amp.html?utm_campaign=fullarticle&amp;utm_medium=referral&amp;utm_source=inshorts,"Russia warns Mariupol residents to 'wear white ribbons or get shot', says mayor: Report",worldnews
MayaNaza99,1650547207,doca-fdg.blogspot.com,https://doca-fdg.blogspot.com/2022/04/7-important-early-pregnancy-tips.html,7 important early pregnancy tips,worldnews
foxwolflion,1650547080,theguardian.com,https://www.theguardian.com/business/2022/apr/21/alekperov-resigns-president-russia-lukoil-putin-oil-eu-uk-sanctions,Putin ally Alekperov resigns as president of Russia’s Lukoil | Oil,worldnews
kipller,1650546940,msn.com,https://www.msn.com/en-us/news/world/european-leaders-back-macron-as-french-campaign-nears-end/ar-AAWrEQI?ocid=EMMX&amp;cvid=8e5bdd81a7394276a8e0b11862b4a20e,European leaders back Macron as French campaign nears end,worldnews
TanzaniaTech,1650546902,tanzaniatech.one,https://www.tanzaniatech.one/2022/04/kununua-kamera-dslr/,Jinsi ya Kununua Kamera Bora na Mambo ya Kuzingatia,worldnews
boskee,1650546857,mirror.co.uk,https://www.mirror.co.uk/news/world-news/breaking-major-fire-erupts-top-26762883,Major fire at top secret Russian defence plant injures 30 as survivors leap out windows,worldnews
chillinwithmypizza,1650546855,foxnews.com,https://www.foxnews.com/media/black-dj-accused-activists-wearing-blackface-speaks-out-shock-experience,Black DJ accused by activists of wearing blackface speaks out on shocking experience,worldnews
red_alert_22,1650546752,timesofisrael.com,https://www.timesofisrael.com/in-bitter-debate-macron-accuses-le-pen-of-being-dependent-on-mr-putin/,"In bitter debate, Macron accuses Le Pen of being 'dependent on Mr. Putin'",worldnews
ThroughtYourMind,1650546322,4state.news,https://4state.news/finnish-legislators-debate-spot-in-nato/,Finnish legislators debate spot in NATO,worldnews
Brann62,1650546316,balkaninsight.com,https://balkaninsight.com/2022/04/21/russia-threatens-moldova-over-ban-on-ukraine-invasion-symbols/,Russia Threatens Moldova Over Ban on Ukraine Invasion Symbols,worldnews
lurker_bee,1650546159,businessinsider.com,https://www.businessinsider.com/mbs-said-punish-biden-move-saudi-closer-russia-china-report-2022-4,"MBS Threatens to Punish Biden by Moving Close to Russia, China: Report",worldnews
APrimitiveMartian,1650546120,organiser.org,https://organiser.org/2022/04/21/77421/world/on-request-india-allows-japan-to-pick-up-supplies-from-mumbai-for-ukraine/,India allows Japan to pick up supplies from Mumbai for Ukraine,worldnews
boskee,1650545966,republicworld.com,https://www.republicworld.com/world-news/russia-ukraine-crisis/russia-massive-fire-at-nii-2-building-of-russian-ministry-of-defence-in-tver-watch-articleshow.html,Russia: Massive fire at NII-2 building of Russian Ministry of Defence in Tver,worldnews
Talink_The_First,1650545889,timesofisrael.com,https://www.timesofisrael.com/lone-wolf-palestinian-terrorists-show-private-gripes-now-top-ideology-say-analysts/,"Lone-wolf Palestinian terrorists show private gripes now top ideology, say analysts",worldnews
Talink_The_First,1650545840,timesofisrael.com,https://www.timesofisrael.com/liveblog-april-21-2022/,"Meeting in Amman, Arab ministers decry Israel's 'blatant provocation' in Jerusalem",worldnews
