author,created_utc,domain,url,title,subreddit
DoremusJessup,1650434632,ukrinform.net,https://www.ukrinform.net/rubric-polytics/3462200-kyslytsya-slams-un-security-council-for-its-impotence-over-crisis-caused-by-russian-invasion.html,Permanent Representative of Ukraine to the UN Sergiy Kyslytsya has criticized the UN Security Council for its impotence in resolving the crisis caused by the Russian invasion of Ukraine,worldnews
MiserableWanker,1650434228,cnbc.com,https://www.cnbc.com/2022/04/19/russian-bank-founder-oleg-tinkov-condemns-ukraine-war-seeks-putin-exit.html,"Sanctioned Russian bank founder Oleg Tinkov condemns 'insane' Ukraine war, calls on West to give Putin face-saving exit",worldnews
MiserableWanker,1650434171,cnbc.com,https://www.cnbc.com/2022/04/20/sri-lanka-opposition-leader-on-no-confidence-vote-to-oust-government.html,Sri Lanka opposition chief says he's 'cautiously optimistic' about vote to oust government,worldnews
DoremusJessup,1650434044,france24.com,https://www.france24.com/en/live-news/20220420-hong-kong-pro-democracy-dj-gets-40-months-in-jail-for-sedition,"A pro-democracy Hong Kong radio DJ was jailed for 40 months on Wednesday for ""seditious speech"" under a British colonial-era law authorities have embraced as China flattens dissent in the city. Tam Tak-chi is among a growing number of activists charged with sedition",worldnews
A-Famous-Werespaniel,1650433929,newshub.co.nz,https://www.newshub.co.nz/home/politics/2022/04/china-solomon-islands-security-agreement-jacinda-ardern-says-no-need-for-deal-expresses-concern-about-militarisation.html,"China, Solomon Islands security agreement: Jacinda Ardern says 'no need' for deal, expresses concern about 'militarisation' of Pacific.",worldnews
AmIWrongEnough,1650433780,wap.business-standard.com,https://wap.business-standard.com/article/international/india-at-unsc-reiterates-call-for-cessation-of-violence-in-ukraine-122042000093_1.html?utm_source=SEO&amp;utm_medium=ST,India at UNSC reiterates call for cessation of violence in Ukraine,worldnews
that1_apple,1650433715,theguardian.com,https://www.theguardian.com/world/2022/apr/20/russias-latest-military-failures-polarise-society-even-more,Russia’s latest military failures polarise society even more,worldnews
No_Dependent_5066,1650433714,theguardian.com,https://www.theguardian.com/global-development/2022/apr/14/deportation-rohingya-woman-india-myanmar-fear-crackdown,Deportation of Rohingya woman from India sparks fear of renewed crackdown | Global development,worldnews
Worried-Boot-1508,1650433557,apnews.com,https://apnews.com/article/russia-ukraine-europe-china-xi-jinping-taiwan-e9f50d985c38c487aba918d088099f9a,China looks to learn from Russian failures in Ukraine,worldnews
hjgbuijhgh,1650433449,independent.co.uk,https://www.independent.co.uk/news/world/americas/elon-musk-spacex-mars-cost-b2060962.html,Elon Musk ridiculed for saying ‘almost anyone’ could afford $100k ticket to Mars,worldnews
[deleted],1650433373,cnbc.com,https://www.cnbc.com/amp/2022/04/19/russia-ukraine-live-updates.html,Ukraine pushes back on 'numerous' Russian advances in Donbas; Zelenskyy warns Mariupol situation is severe,worldnews
V_M2022,1650433302,aljazeera.com,https://www.aljazeera.com/news/2022/4/19/palestinians-injured-after-israeli-settlers-march-outpost,Palestinians injured after Israeli settlers march to outpost | Israel-Palestine conflict News,worldnews
No_Dependent_5066,1650433215,usip.org,https://www.usip.org/publications/2022/04/ukraine-crisis-prompts-china-swing-behind-myanmars-junta,Ukraine Crisis Prompts China to Swing Behind Myanmar’s Junta,worldnews
Brann62,1650432719,cnbc.com,https://www.cnbc.com/2022/04/19/russia-ukraine-live-updates.html,Ukraine pushes back on 'numerous' Russian advances in Donbas; Zelenskyy warns Mariupol situation is severe,worldnews
sunjay140,1650432468,bloombergquint.com,https://www.bloombergquint.com/politics/australia-deeply-disappointed-after-solomons-signs-china-pact,Australia ‘Deeply Disappointed’ After Solomons Signs China Pact,worldnews
boskee,1650432452,notesfrompoland.com,https://notesfrompoland.com/2022/04/19/poland-renews-push-to-remove-soviet-monuments-amid-russias-war-in-ukraine/,Poland renews push to remove Soviet monuments amid Russia’s war in Ukraine,worldnews
dahilahljaaaljol,1650432296,yahoo.com,https://www.yahoo.com/news/taiwan-tv-station-apologises-mistakenly-042955867.html,Taiwan TV station apologises after mistakenly reporting Chinese attack,worldnews
Unique_District_9381,1650432002,theepochtimes.com,https://www.theepochtimes.com/lavrov-denies-russia-could-use-nuclear-weapons-in-ukraine_4413755.html,Lavrov Denies Russia Could Use Nuclear Weapons in Ukraine,worldnews
PuddingMango,1650431867,reuters.com,https://www.reuters.com/world/asia-pacific/taiwan-tv-station-apologises-after-mistakenly-reporting-chinese-attack-2022-04-20/,Taiwan TV station apologises after mistakenly reporting Chinese attack,worldnews
ObligationGlum,1650431731,regjeringen.no,https://www.regjeringen.no/no/aktuelt/norge-har-donert-luftvernsystem-til-ukraina/id2908807/,Norway decides to donate Mistral-Manpads to Ukraine,worldnews
[deleted],1650431535,cnbc.com,https://www.cnbc.com/2022/04/19/russia-ukraine-live-updates.html,Ukraine pushes back on ‘numerous’ Russian advances in Donbas; Zelenskyy warns Mariupol situation is severe,worldnews
bobybobobo,1650431512,lemonde.fr,https://www.lemonde.fr/en/environment/article/2022/04/18/nestle-remains-silent-on-child-deaths-from-contaminated-pizzas_5980892_114.html,Nestlé remains silent on child deaths from contaminated pizzas in France,worldnews
hjgbuijhgh,1650431351,news.sky.com,https://news.sky.com/story/netflix-shares-plunge-as-subscribers-fall-for-first-time-in-a-decade-12594015,Netflix shares plunge as subscribers fall for first time in a decade,worldnews
ChocolateTsar,1650431275,kyivindependent.com,https://kyivindependent.com/national/kharkiv-oblast-resident-forcibly-deported-to-russia-its-not-a-country-its-a-prison/,"Kharkiv Oblast resident forcibly deported to Russia: ‘It’s not a country, it’s a prison’",worldnews
crushedpumpkin,1650430808,theguardian.com,https://www.theguardian.com/world/2022/apr/20/ukraine-repelling-intense-russian-offensive-in-east-uk-says-as-mariupol-troops-face-last-hours,"Ukraine repelling intense Russian offensive in east, UK says, as Mariupol troops face ‘last hours’",worldnews
Nikolas_5,1650430807,reuters.com,https://www.reuters.com/world/europe/ukraines-military-gets-more-aircraft-parts-repair-others-pentagon-says-2022-04-19/?taid=625f59e7d7fd76000156fe15&amp;utm_campaign=trueAnthem:+Trending+Content&amp;utm_medium=trueAnthem&amp;utm_source=twitter,"Ukraine's military gets more aircraft and parts to repair others, Pentagon says",worldnews
crushedpumpkin,1650430754,businessinsider.com,https://www.businessinsider.com/putin-four-objectives-donbas-war-plan-grab-land-negotiations-2022-4?utm_source=feedly&amp;utm_medium=webfeeds,"Russia wants to use the 2nd phase of the war in Ukraine to seize more land as bargaining chips, European official says",worldnews
shininglights22,1650430600,shininglight-piercing.com,https://www.shininglight-piercing.com/,Wholesale Body Jewelry &amp; Tattoo Supply,worldnews
bobybobobo,1650430564,cnbc.com,https://www.cnbc.com/2022/04/19/netflix-warns-password-sharing-crackdown-is-coming.html,Netflix estimates 100 million households are sharing passwords and suggests a global crackdown is coming,worldnews
Russell_3,1650430520,reuters.com,https://www.reuters.com/world/solomon-islands-pm-says-security-pact-with-china-wont-undermine-regional-peace-2022-04-19/?taid=625f7f69d7fd76000157070f&amp;utm_campaign=trueAnthem:+Trending+Content&amp;utm_medium=trueAnthem&amp;utm_source=twitter,Solomon Islands PM says security pact with China won't undermine regional peace,worldnews
grab-n-g0,1650429976,apnews.com,https://apnews.com/article/covid-science-business-health-82d673c5cfd213e089c24e2e2eb90d20,Moderna announces step toward updating COVID shots for fall,worldnews
cheistina,1650429954,centralamerica.com,https://www.centralamerica.com/news/costa-rica-cyber-attack-currently-underway/?amp=1,"Ciber attack on Costa Rica (no army) by Russian ,”hacking by hire”",worldnews
that1_apple,1650429432,jdsupra.com,https://www.jdsupra.com/legalnews/eu-s-fifth-wave-of-russia-sanctions-1480774/,"EU’s Fifth Wave of Russia sanctions target Russian coal imports, Russia-related trusts and exclude Russian persons from EU road transport, public contracts and EU funding",worldnews
mixplate,1650429258,independent.co.uk,https://www.independent.co.uk/news/uk/politics/marine-le-pen-national-front-tory-b2060706.html,"Tory and Brexit supporters back far-right Marine Le Pen to become French president, poll reveals",worldnews
bangthetank,1650429013,reuters.com,https://www.reuters.com/world/europe/britain-examining-anti-ship-missile-solution-ukraine-2022-04-19/,Britain examining anti-ship missile solution for Ukraine,worldnews
bangthetank,1650428965,ndtv.com,https://www.ndtv.com/world-news/biden-to-announce-another-large-military-aid-package-for-ukraine-report-2902534,Biden To Announce Another Large Military Aid Package For Ukraine: Report,worldnews
Personal_Occasion618,1650428826,news.yahoo.com,https://news.yahoo.com/deceased-train-driver-japan-awarded-000813746.html,Deceased train driver in Japan awarded 45 cents after his pay was deducted for 1-minute delay in 2020,worldnews
knowledge24website,1650428635,knowledge24.website,https://www.knowledge24.website/2022/03/What-is-Email-Knowledge-about-the%20-Email-Email-Knowledge-24.html,FACTS ABOUT THE EMAIL,worldnews
knowledge24website,1650428609,knowledge24.website,https://www.knowledge24.website/2022/03/Importance-Of-Knowledge-Importance-of-knowledge-essay-Importance-Of-Knowledge-In-Islam.html,KNOWLEDGE,worldnews
RepresentativeDry372,1650428600,youtu.be,https://youtu.be/lDc1QHP_E1Y,Red Lace Lounge Podcast,worldnews
knowledge24website,1650428594,knowledge24.website,https://www.knowledge24.website/2022/03/Importance-Of-Knowledge-Importance-of-knowledge-essay-Importance-Of-Knowledge-In-Islam.html,POWER OF KNOWLEDGE,worldnews
bangthetank,1650428592,ndtv.com,https://www.ndtv.com/world-news/russia-expelling-over-30-european-diplomats-amid-ukraine-war-2902476,"In Tit-For-Tat Move, Russia Expelling Over 30 European Diplomats",worldnews
knowledge24website,1650428573,knowledge24.website,https://www.knowledge24.website/2022/03/Importance-Of-Knowledge-Importance-of-knowledge-essay-Importance-Of-Knowledge-In-Islam.html,POWER OF KNOWLEDGE AND AMERICA,worldnews
bangthetank,1650428541,timesofindia.indiatimes.com,https://timesofindia.indiatimes.com/world/europe/russia-pours-in-more-troops-and-presses-attack-in-the-east/articleshow/90948029.cms,russia: Russia pours in more troops and presses attack in the east - Times of India,worldnews
RepresentativeDry372,1650428538,youtube.com,https://youtube.com/watch?v=lDc1QHP_E1Y&amp;feature=share,Red Lace Lounge Podcast S01 E03~ Adults Only,worldnews
knowledge24website,1650428526,knowledge24.website,https://www.knowledge24.website/2022/03/General-Knowledge-about-the-Pakistan--Importance-of-Pakistan-in-the-World.html,general knowledge about Pakistan,worldnews
knowledge24website,1650428494,knowledge24.website,https://www.knowledge24.website/2022/03/Most-Dangerous-Road-in-the-World-Top-10-Most-Dangerous-Road-in-the-World.html,most dangerous road in the world,worldnews
knowledge24website,1650428462,knowledge24.website,https://www.knowledge24.website/2022/03/Social-Play-In-Early-Childhood-Social-Play%20-Importance-Of-Social-Play.html,social play in early childhood,worldnews
knowledge24website,1650428419,knowledge24.website,https://www.knowledge24.website/2022/02/Nonlinguistic-Communication-Nature-of-Communication.html,Nonlinguistic Communication,worldnews
crushedpumpkin,1650428037,abcnews.go.com,https://abcnews.go.com/Politics/russian-offensive-limited-fall-mariupol-inevitable-pentagon-update/story?id=84171542,"Russian offensive 'limited' so far, fall of Mariupol 'not inevitable': Pentagon update Day 55",worldnews
Altruistic_Yard608,1650427648,updateonbitcoin.com,https://updateonbitcoin.com/elon-musk-wins-deal-to-buy-twitter/,Elon Musk wins deal to buy Twitter,worldnews
Excypherz,1650427555,forbes.com,https://www.forbes.com/sites/davidaxe/2022/04/19/the-ukrainian-air-force-just-got-bigger-it-seems-someone-gave-kyiv-more-mig-29s/?sh=6b0581243c8b,The Ukrainian Air Force Just Got Bigger. It Seems Someone Gave Kyiv More MiG-29s.,worldnews
WorldNewsMods,1650427358,reddit.com,https://www.reddit.com/live/18hnzysb1elcs,"/r/WorldNews Live Thread: Russian Invasion of Ukraine Day 56, Part 1 (Thread #195)",worldnews
MadeMediaMagazine,1650427025,youtu.be,https://youtu.be/KN_AMDB30gs,6ix9ine Goon Say He The First Rat Gang Accepted!,worldnews
madamplease,1650426493,newindianexpress.com,https://www.newindianexpress.com/nation/2022/apr/19/russian-officials-in-talks-with-indian-govt-rbi-to-find-solution-on-payments-russian-diplomat-2443936.html,"Russian officials in talks with Indian govt, RBI to find solution on payments: Russian diplomat",worldnews
crushedpumpkin,1650426269,newsweek.com,https://www.newsweek.com/army-considers-sending-national-guard-troops-eastern-europe-1699159,Army Considers Sending National Guard Troops to Eastern Europe,worldnews
acoreif,1650426066,cnn.com,https://www.cnn.com/videos/world/2022/04/19/mariupol-ukraine-purported-audio-russian-commander-rivers-pkg-ebof-vpx.cnn,'Level everything to the ground': Purported communications of Russian commander,worldnews
HovercraftNo1808,1650426064,youtube.com,https://www.youtube.com/watch?v=fhd-joSlmnE&amp;feature=youtu.be,New video by KAILASA's SPH Nithyananda on YouTube,worldnews
fastclickertoggle,1650426033,theguardian.com,https://www.theguardian.com/business/2022/apr/19/energy-chiefs-fear-40-of-britons-could-fall-into-fuel-poverty-in-truly-horrific-winter,Energy chiefs fear 40% of Britons could fall into fuel poverty in ‘truly horrific winter’,worldnews
Najariya,1650425741,youtube.com,https://youtube.com/shorts/aHFPJ04ueNM?feature=share,I love juu plz support,worldnews
Olehsioioa,1650425475,yahoo.com,https://www.yahoo.com/tech/m/7318ae25-6abc-3b26-902f-62113bdef662/another-big-shipping-line-is.html,Another big shipping line is refusing to export the West’s plastic waste,worldnews
Olehsioioa,1650425351,yahoo.com,https://www.yahoo.com/news/killers-confronted-humpback-whale-turns-151607374.html,Killers confronted: humpback whale turns on orca pod in rare encounter,worldnews
BlueZybez,1650425286,scmp.com,https://www.scmp.com/news/world/russia-central-asia/article/3174846/ukraine-war-mariupol-marine-says-enemy-outnumbering?module=live&amp;pgtype=homepage,"Mariupol marine pleads for help, says ‘enemy outnumbering us 10 to one’",worldnews
DoremusJessup,1650425259,asahi.com,https://www.asahi.com/ajw/articles/14602089,Voters in East Timor are choosing a president in a runoff Tuesday between former independence fighters. Nobel Peace Prize laureate Jose Ramos-Horta had a commanding lead in the election’s first round but failed to exceed 50 percent of the votes,worldnews
FrontSome9740,1650424689,france24.com,https://www.france24.com/en/asia-pacific/20220419-several-killed-in-twin-explosions-at-shiite-school-in-afghan-capital,Several killed in twin explosions at Shiite school in Afghan capital,worldnews
eve-dude,1650424637,cnn.com,https://www.cnn.com/2022/04/08/asia/yakuza-us-missiles-drugs-japan-myanmar-rebels-intl-hnk/index.html,"US arrests alleged yakuza leader on drugs, weapons charges",worldnews
[deleted],1650424519,nypost.com,https://nypost.com/2022/04/19/china-buses-shanghai-covid-patients-to-quarantine-sites/,China buses Shanghai COVID patients to quarantine sites,worldnews
spinx248,1650424370,yahoo.com,https://www.yahoo.com/news/saudi-crown-prince-mohammed-bin-201402325.html,"Saudi crown prince Mohammed bin Salman started 'shouting' at Biden's national security advisor when he brought up Jamal Khashoggi's brutal killing, report says",worldnews
spinx248,1650424260,bbc.co.uk,https://www.bbc.co.uk/news/world-asia-61117434,Why Koreans could soon become a year younger,worldnews
fastclickertoggle,1650423274,bnnbloomberg.ca,https://www.bnnbloomberg.ca/31-of-canadians-don-t-earn-enough-to-cover-their-bills-survey-1.1753377,31% of Canadians don't earn enough to pay their bills: Survey,worldnews
Distinct-Coyote-3173,1650423233,nytimes.com,https://www.nytimes.com/2022/04/19/us/ukraine-family-separations.html,Ukrainian Children and Caregivers Are Being Separated at U.S. Border,worldnews
BousWakebo,1650422968,reuters.com,https://www.reuters.com/world/europe/biden-announce-another-large-military-aid-package-ukraine-sources-say-2022-04-19/,"Biden to announce another large military aid package for Ukraine, sources say",worldnews
tta2013,1650422961,news.mongabay.com,https://news.mongabay.com/2022/04/south-africa-declares-national-emergency-as-flood-toll-crosses-440/,South Africa declares national emergency as flood toll crosses 440,worldnews
MicroSofty88,1650422813,thetimes.co.uk,https://www.thetimes.co.uk/article/russia-uses-bunker-buster-bombs-in-final-assault-on-mariupol-steelworks-3blkbsjn7,Russia ‘uses bunker-buster bombs’ in final assault on Mariupol steelworks,worldnews
crushedpumpkin,1650421927,businessinsider.com,https://www.businessinsider.com/more-than-5000-ukrainian-refugees-came-to-us-in-march-2022-4?utm_source=feedly&amp;utm_medium=webfeeds,"More than 5,000 Ukrainian migrants were detained at US borders in March despite no official immigration path",worldnews
RichKatz,1650421875,abc.net.au,https://www.abc.net.au/news/2022-04-20/ukraine-russia-war-live-pdates-putin-zelenskyy/101000788,Ukraine-Russia war live: Phone communication between Chernobyl and the nuclear regulator has been restored,worldnews
Distinct-Coyote-3173,1650421865,nytimes.com,https://www.nytimes.com/2022/04/19/world/europe/mariupol-azovstal-steel-plant.html,Despair in Mariupol’s last stronghold: ‘They’re bombing us with everything’,worldnews
ZeyElFull,1650421577,dw.com,https://www.dw.com/en/in-the-bubble-tel-aviv-after-the-attack/a-61516049,In the bubble — Tel Aviv after the attack,worldnews
ZeyElFull,1650421472,news.yahoo.com,https://news.yahoo.com/biden-reluctant-remove-irans-revolutionary-013520429.html,Biden reluctant to remove Iran's Revolutionary Guards from terror list,worldnews
Xul-luX,1650421219,reuters.com,https://www.reuters.com/news/picture/one-dead-after-police-fire-on-protesters-idUSKCN2MB059,One dead after police fire on protesters in Sri Lanka amid bailout talks with IMF,worldnews
Nvnv_man,1650421157,pravda.com.ua,https://www.pravda.com.ua/rus/news/2022/04/19/7340798/,The Moskva cruiser was intending an amphibious assault landing Odesa,worldnews
ChoicePilot49,1650421119,theverge.com,https://www.theverge.com/2022/4/19/23031870/mask-rule-transportation-airlines-trains-uber-cdc,"Uber, Amtrak, airlines drop mask requirements after judge strikes down rule",worldnews
ThisIsExxciting,1650420753,theguardian.com,https://www.theguardian.com/world/2022/apr/19/shanghai-prepares-to-ease-covid-lockdown-as-factories-reopen,Shanghai prepares to ease Covid lockdown as factories reopen,worldnews
amnesiac7,1650420362,time.com,https://time.com/6167970/marine-le-pen-french-elections/,Voters in Rural France Are Embracing Marine Le Pen's Far Right Vision,worldnews
adfawetg,1650420308,utamap.com,https://www.utamap.com/media/datsumou/datsumou01.html,脇脱毛にかかる回数・期間は？脇脱毛のメリットと後悔しないクリニック・サロン選びのコツ,worldnews
Olehsioioa,1650420224,yahoo.com,https://www.yahoo.com/news/continue-brave-surviving-wwii-filipino-185913812.html,"'I will continue to be brave': Surviving WWII Filipino 'comfort women' fight for recognition, apology",worldnews
Olehsioioa,1650420188,yahoo.com,https://www.yahoo.com/finance/news/taiwan-seeks-indo-pacific-economic-101557160.html,Taiwan seeks Indo-Pacific Economic Framework membership with U.S,worldnews
Olehsioioa,1650420126,yahoo.com,https://www.yahoo.com/news/indias-first-openly-gay-prince-165724777.html,"India's first openly gay prince endured years of torturous conversion therapy. Now, he's fighting to make the practice illegal.",worldnews
Olehsioioa,1650420104,yahoo.com,https://www.yahoo.com/news/rescuers-search-survivors-deadly-indonesia-163829388.html,Rescuers search for survivors after deadly Indonesia market collapse,worldnews
Minneapolitanian,1650419972,euronews.com,https://www.euronews.com/2022/04/19/french-police-investigate-fire-at-russian-orthodox-church-in-paris,French police investigate fire at Russian Orthodox Church in Paris,worldnews
bogusssssss,1650419832,cruxnow.com,https://cruxnow.com/church-in-europe/2022/04/ukrainian-officer-in-mariupol-writes-to-pope-from-hell-on-earth,Ukrainian officer in Mariupol writes to Pope from ‘hell on earth’,worldnews
Minneapolitanian,1650419811,rferl.org,https://www.rferl.org/a/moldova-bans-russian-symbols-sandu-ukraine/31811318.html,Moldovan President Signs Law Banning Symbols Of Russia Aggression; Lithuanian Parliament Passes Similar Ban,worldnews
bogusssssss,1650419572,cnn.com,https://www.cnn.com/europe/live-news/ukraine-russia-putin-news-04-19-22/h_8929b6c8af71595eec6c74cc2ccf4215,"Ukrainian commander requests international evacuation effort at Mariupol plant as situation is ""critical""",worldnews
asparagusburgers,1650419488,reuters.com,https://www.reuters.com/lifestyle/sports/report-wimbledon-bar-russian-players-2022-04-20/,Report: Wimbledon to bar Russian players,worldnews
ynoor671,1650419022,youtu.be,https://youtu.be/bkDGeW5IweQ,https://youtu.be/bkDGeW5IweQ,worldnews
No_Butterscotch8504,1650418768,seekingalpha.com,https://seekingalpha.com/news/3824375-china-tells-steel-industry-to-cut-production-adding-to-industrial-export-restrictions,"China tells steel industry to cut production, adding to industrial export restrictions",worldnews
nowayfound,1650418401,reuters.com,https://www.reuters.com/world/americas/northern-mexico-authorities-search-missing-women-amid-spate-disappearances-2022-04-20/,"In northern Mexico, authorities search for missing women amid spate of disappearances",worldnews
opeifu,1650418378,reuters.com,https://www.reuters.com/world/middle-east/new-surrender-deadline-mariupol-west-promises-ukraine-more-arms-2022-04-19/,New surrender deadline in Mariupol as West promises Ukraine more arms,worldnews
acoreif,1650418359,reuters.com,https://www.reuters.com/business/energy/oil-prices-rise-1-after-sinking-previous-session-2022-04-20/,Oil prices rise 1% after sinking in previous session,worldnews
VanGoghEnjoyer,1650417735,theguardian.com,https://www.theguardian.com/world/2022/apr/19/sri-lanka-one-dead-and-several-wounded-as-police-shoot-protesters,Sri Lanka: One dead and several wounded as police shoot protesters,worldnews
lurker_bee,1650416458,abc7.com,https://abc7.com/oldest-living-dog-guinness-world-record-florida-dogs/11768715/,21-year-old Florida chihuahua is the oldest living dog in the world,worldnews
prixb,1650416218,reuters.com,https://www.reuters.com/world/biden-allies-hold-video-call-ukraine-2022-04-19/,"U.S., Britain, Canada pledge artillery for Ukraine",worldnews
hidraulik,1650416189,amp.abc.net.au,https://amp.abc.net.au/article/100997186,Vladimir Putin's rumoured purge over his disastrous war in Ukraine could show he fell into the 'dictator trap' - ABC News,worldnews
Ifukbull,1650416098,nytimes.com,https://www.nytimes.com/2022/04/19/health/omicron-unvaccinated-children.html?unlocked_article_code=AAAAAAAAAAAAAAAACEIPuomT1JKd6J17Vw1cRCfTTMQmqxCdw_PIxftm3iWka3DJDm8TiOQYCoyc-wDKYKtofdw1mimdWtZKO74pTeB_wqpUP01pRxOlpN2EhJEBaW0TmL6EY1kXjdjLTKxqtnjjdHW4I-Nyg-zg70rYO2DqRPbehCA-IA9u849uIlv5xXwCzqbAEuQkitV0iOwzRcwvHUd2byGPtvTsDB16MczXLU2Pr1lrBJwKHG3bjtWe6LkfcQhNClugTXp342k06d40K8pAde-kbEZmIJyi9O1XXm94L46pBIkzQ5zUlthosL3Mrh-Ozamm1s4iKWkFDp3QE_iLa1FMQ5w,"Omicron Was More Severe for Unvaccinated Children in 5-to-11 Age Group, Study Shows",worldnews
Saltedline,1650415744,koreatimes.co.kr,https://www.koreatimes.co.kr/www/tech/2022/04/129_327609.html,Korea revises visa rules to secure more foreign workers for shipbuilders,worldnews
CognitiveFunction34,1650415706,thehill.com,https://thehill.com/policy/international/3272945-un-asks-for-66m-to-protect-ukrainian-women-children-amid-rape-accusations/,"UN asks for $66M to protect Ukrainian women, children amid rape accusations",worldnews
Minneapolitanian,1650415634,reuters.com,https://www.reuters.com/world/middle-east/turkey-says-erdogan-israels-herzog-speak-after-jerusalem-clashes-2022-04-19/,Erdogan tells Herzog he is 'very upset' by injured or killed Palestinians,worldnews
TheFunnyShah,1650415552,newsweek.com,https://www.newsweek.com/methane-feedback-loop-beyond-humans-ability-control-may-have-begun-1697512,Climate Change: NOAA suggests that methane feedback-oop may have already begun,worldnews
Ifukbull,1650415457,m.jpost.com,https://m.jpost.com/health-and-wellness/article-704636,About 30% of COVID patients suffer from 'long COVID'- study,worldnews
TheFunnyShah,1650415442,newsweek.com,https://www.newsweek.com/methane-feedback-loop-beyond-humans-ability-control-may-have-begun-1697512,NOAA: Methane feedback loop may have already begun,worldnews
Own_Money_4430,1650415341,tab.gladly.io,https://tab.gladly.io/ukraine/?u=gameman93%40msn.com,Help support Ukrainian families,worldnews
Minneapolitanian,1650415329,reuters.com,https://www.reuters.com/world/us-japan-australia-new-zealand-concerned-by-solomon-islands-china-pact-2022-04-20/,"U.S, Japan, Australia and New Zealand concerned by Solomon Islands-China pact",worldnews
Saltedline,1650415228,english.kyodonews.net,https://english.kyodonews.net/news/2022/04/8ab030d84da3-urgent-us-japan-eu-leaders-affirm-swift-support-to-ukraine-amid-war.html,"U.S., Japan, EU affirm swift aid to Ukraine as assault in east starts",worldnews
